start_time,end_time,time_range,search_name,alert,duration_values,duration,cpu,read_count,write_count,read_bytes,write_bytes,memory_mb
12/01/2024:00:00:00,12/03/2024:00:00:00,"(Timestamp('2024-12-01 00:00:00'), Timestamp('2024-12-03 00:00:00'))",Clop Ransomware Known Service Name,0,,6.955,1.79,14952.0,87.0,34025472.0,139264.0,13.734375
12/01/2024:00:00:00,12/03/2024:00:00:00,"(Timestamp('2024-12-01 00:00:00'), Timestamp('2024-12-03 00:00:00'))",Detect New Local Admin account,0,,9.523,4.34,101962.0,386.0,14929920.0,249856.0,24.44921875
12/01/2024:00:00:00,12/03/2024:00:00:00,"(Timestamp('2024-12-01 00:00:00'), Timestamp('2024-12-03 00:00:00'))",ESCU Network Share Discovery Via Dir Command Rule,0,,15.951,8.49,79662.0,481.0,141615104.0,475136.0,22.35546875
12/01/2024:00:00:00,12/03/2024:00:00:00,"(Timestamp('2024-12-01 00:00:00'), Timestamp('2024-12-03 00:00:00'))",ESCU Windows Rapid Authentication On Multiple Hosts Rule,0,,13.238,7.0,54165.0,834.0,118784000.0,495616.0,13.7578125
12/01/2024:00:00:00,12/03/2024:00:00:00,"(Timestamp('2024-12-01 00:00:00'), Timestamp('2024-12-03 00:00:00'))",Kerberoasting spn request with RC4 encryption,0,,9.971,3.95,51010.0,429.0,77578240.0,278528.0,25.0234375
12/01/2024:00:00:00,12/03/2024:00:00:00,"(Timestamp('2024-12-01 00:00:00'), Timestamp('2024-12-03 00:00:00'))",Known Services Killed by Ransomware,0,,11.876,4.9,34367.0,472.0,115691520.0,466944.0,29.5234375
12/01/2024:00:00:00,12/03/2024:00:00:00,"(Timestamp('2024-12-01 00:00:00'), Timestamp('2024-12-03 00:00:00'))",Non Chrome Process Accessing Chrome Default Dir,0,,14.67,6.69,64902.0,521.0,148758528.0,487424.0,30.3671875
12/01/2024:00:00:00,12/03/2024:00:00:00,"(Timestamp('2024-12-01 00:00:00'), Timestamp('2024-12-03 00:00:00'))",Windows AD Replication Request Initiated from Unsanctioned Location,0,,25.83,20.31,225289.0,467.0,108388352.0,651264.0,40.98046875
12/01/2024:00:00:00,12/03/2024:00:00:00,"(Timestamp('2024-12-01 00:00:00'), Timestamp('2024-12-03 00:00:00'))",Windows Event For Service Disabled,0,,14.98,7.1,55717.0,533.0,159485952.0,495616.0,46.95703125
04/01/2025:00:00:00,04/03/2025:00:00:00,"(Timestamp('2025-04-01 00:00:00'), Timestamp('2025-04-03 00:00:00'))",Clop Ransomware Known Service Name,0,,32.016,2.97,30027.0,500.0,156139520.0,708608.0,18.734375
04/01/2025:00:00:00,04/03/2025:00:00:00,"(Timestamp('2025-04-01 00:00:00'), Timestamp('2025-04-03 00:00:00'))",Detect New Local Admin account,0,,33.817,4.83,80513.0,656.0,161026048.0,778240.0,27.015625
04/01/2025:00:00:00,04/03/2025:00:00:00,"(Timestamp('2025-04-01 00:00:00'), Timestamp('2025-04-03 00:00:00'))",ESCU Network Share Discovery Via Dir Command Rule,0,,33.656,5.66,70597.0,672.0,278958080.0,839680.0,12.48046875
04/01/2025:00:00:00,04/03/2025:00:00:00,"(Timestamp('2025-04-01 00:00:00'), Timestamp('2025-04-03 00:00:00'))",ESCU Windows Rapid Authentication On Multiple Hosts Rule,0,,39.761,13.88,57036.0,821.0,286732288.0,1007616.0,34.13671875
04/01/2025:00:00:00,04/03/2025:00:00:00,"(Timestamp('2025-04-01 00:00:00'), Timestamp('2025-04-03 00:00:00'))",Kerberoasting spn request with RC4 encryption,0,,32.254,4.19,55032.0,557.0,207544320.0,737280.0,21.43359375
04/01/2025:00:00:00,04/03/2025:00:00:00,"(Timestamp('2025-04-01 00:00:00'), Timestamp('2025-04-03 00:00:00'))",Known Services Killed by Ransomware,3,,34.514,4.76,47701.0,684.0,285777920.0,1089536.0,42.4921875
04/01/2025:00:00:00,04/03/2025:00:00:00,"(Timestamp('2025-04-01 00:00:00'), Timestamp('2025-04-03 00:00:00'))",Non Chrome Process Accessing Chrome Default Dir,0,,33.482,5.890000000000001,66339.0,548.0,265621504.0,757760.0,26.83984375
04/01/2025:00:00:00,04/03/2025:00:00:00,"(Timestamp('2025-04-01 00:00:00'), Timestamp('2025-04-03 00:00:00'))",Windows AD Replication Request Initiated from Unsanctioned Location,0,,50.516,9.69,139434.0,809.0,577605632.0,1298432.0,36.09375
04/01/2025:00:00:00,04/03/2025:00:00:00,"(Timestamp('2025-04-01 00:00:00'), Timestamp('2025-04-03 00:00:00'))",Windows Event For Service Disabled,1,,34.527,6.59,72946.0,684.0,383197184.0,901120.0,46.46484375
12/24/2024:00:00:00,12/26/2024:00:00:00,"(Timestamp('2024-12-24 00:00:00'), Timestamp('2024-12-26 00:00:00'))",Clop Ransomware Known Service Name,0,,26.397,2.28,19096.0,396.0,132960256.0,593920.0,16.75
12/24/2024:00:00:00,12/26/2024:00:00:00,"(Timestamp('2024-12-24 00:00:00'), Timestamp('2024-12-26 00:00:00'))",Detect New Local Admin account,0,,29.624,3.49,82894.0,343.0,152866816.0,724992.0,4.78125
12/24/2024:00:00:00,12/26/2024:00:00:00,"(Timestamp('2024-12-24 00:00:00'), Timestamp('2024-12-26 00:00:00'))",ESCU Network Share Discovery Via Dir Command Rule,0,,31.683,5.76,66121.0,449.0,241336320.0,765952.0,17.06640625
12/24/2024:00:00:00,12/26/2024:00:00:00,"(Timestamp('2024-12-24 00:00:00'), Timestamp('2024-12-26 00:00:00'))",ESCU Windows Rapid Authentication On Multiple Hosts Rule,0,,29.427,4.92,42434.0,401.0,196243456.0,651264.0,17.78515625
12/24/2024:00:00:00,12/26/2024:00:00:00,"(Timestamp('2024-12-24 00:00:00'), Timestamp('2024-12-26 00:00:00'))",Kerberoasting spn request with RC4 encryption,0,,28.614,3.6,50646.0,527.0,155090944.0,700416.0,23.53515625
12/24/2024:00:00:00,12/26/2024:00:00:00,"(Timestamp('2024-12-24 00:00:00'), Timestamp('2024-12-26 00:00:00'))",Known Services Killed by Ransomware,0,,26.972,4.79,36376.0,521.0,187871232.0,774144.0,23.39453125
12/24/2024:00:00:00,12/26/2024:00:00:00,"(Timestamp('2024-12-24 00:00:00'), Timestamp('2024-12-26 00:00:00'))",Non Chrome Process Accessing Chrome Default Dir,0,,31.141,4.98,61014.0,471.0,208609280.0,708608.0,22.11328125
12/24/2024:00:00:00,12/26/2024:00:00:00,"(Timestamp('2024-12-24 00:00:00'), Timestamp('2024-12-26 00:00:00'))",Windows AD Replication Request Initiated from Unsanctioned Location,0,,45.712,13.3,148663.0,502.0,517431296.0,1007616.0,20.5859375
12/24/2024:00:00:00,12/26/2024:00:00:00,"(Timestamp('2024-12-24 00:00:00'), Timestamp('2024-12-26 00:00:00'))",Windows Event For Service Disabled,1,,29.139,6.17,55333.0,529.0,274927616.0,671744.0,36.71875
02/04/2025:16:00:00,02/06/2025:16:00:00,"(Timestamp('2025-02-04 16:00:00'), Timestamp('2025-02-06 16:00:00'))",Clop Ransomware Known Service Name,0,,30.446,2.81,30580.0,672.0,209715200.0,778240.0,8.66796875
02/04/2025:16:00:00,02/06/2025:16:00:00,"(Timestamp('2025-02-04 16:00:00'), Timestamp('2025-02-06 16:00:00'))",Detect New Local Admin account,0,,37.046,5.12,105490.0,425.0,268034048.0,806912.0,27.34765625
02/04/2025:16:00:00,02/06/2025:16:00:00,"(Timestamp('2025-02-04 16:00:00'), Timestamp('2025-02-06 16:00:00'))",ESCU Network Share Discovery Via Dir Command Rule,0,,43.037,7.33,89915.0,561.0,408023040.0,962560.0,22.9765625
02/04/2025:16:00:00,02/06/2025:16:00:00,"(Timestamp('2025-02-04 16:00:00'), Timestamp('2025-02-06 16:00:00'))",ESCU Windows Rapid Authentication On Multiple Hosts Rule,0,,44.347,12.37,71756.0,814.0,378470400.0,1155072.0,47.70703125
02/04/2025:16:00:00,02/06/2025:16:00:00,"(Timestamp('2025-02-04 16:00:00'), Timestamp('2025-02-06 16:00:00'))",Kerberoasting spn request with RC4 encryption,0,,31.682,4.220000000000001,63849.0,573.0,215654400.0,720896.0,25.625
02/04/2025:16:00:00,02/06/2025:16:00:00,"(Timestamp('2025-02-04 16:00:00'), Timestamp('2025-02-06 16:00:00'))",Known Services Killed by Ransomware,3,,38.585,6.5,63317.0,800.0,352305152.0,1179648.0,22.453125
02/04/2025:16:00:00,02/06/2025:16:00:00,"(Timestamp('2025-02-04 16:00:00'), Timestamp('2025-02-06 16:00:00'))",Non Chrome Process Accessing Chrome Default Dir,0,,38.938,5.720000000000001,79052.0,590.0,298405888.0,888832.0,30.91015625
02/04/2025:16:00:00,02/06/2025:16:00:00,"(Timestamp('2025-02-04 16:00:00'), Timestamp('2025-02-06 16:00:00'))",Windows AD Replication Request Initiated from Unsanctioned Location,0,,90.893,19.79,220601.0,719.0,1543634944.0,1986560.0,46.734375
02/04/2025:16:00:00,02/06/2025:16:00:00,"(Timestamp('2025-02-04 16:00:00'), Timestamp('2025-02-06 16:00:00'))",Windows Event For Service Disabled,1,,41.382,8.81,96139.0,839.0,500490240.0,1077248.0,36.3984375
03/13/2025:08:00:00,03/15/2025:08:00:00,"(Timestamp('2025-03-13 08:00:00'), Timestamp('2025-03-15 08:00:00'))",Clop Ransomware Known Service Name,0,,12.642,2.52,26668.0,528.0,85000192.0,397312.0,3.63671875
03/13/2025:08:00:00,03/15/2025:08:00:00,"(Timestamp('2025-03-13 08:00:00'), Timestamp('2025-03-15 08:00:00'))",Detect New Local Admin account,0,,18.126,3.11,48459.0,375.0,97685504.0,417792.0,27.86328125
03/13/2025:08:00:00,03/15/2025:08:00:00,"(Timestamp('2025-03-13 08:00:00'), Timestamp('2025-03-15 08:00:00'))",ESCU Network Share Discovery Via Dir Command Rule,0,,18.164,5.220000000000001,70529.0,616.0,151494656.0,532480.0,8.734375
03/13/2025:08:00:00,03/15/2025:08:00:00,"(Timestamp('2025-03-13 08:00:00'), Timestamp('2025-03-15 08:00:00'))",ESCU Windows Rapid Authentication On Multiple Hosts Rule,0,,27.244,9.97,55728.0,778.0,171851776.0,806912.0,30.1640625
03/13/2025:08:00:00,03/15/2025:08:00:00,"(Timestamp('2025-03-13 08:00:00'), Timestamp('2025-03-15 08:00:00'))",Kerberoasting spn request with RC4 encryption,0,,16.018,3.4,53578.0,503.0,108003328.0,413696.0,21.86328125
03/13/2025:08:00:00,03/15/2025:08:00:00,"(Timestamp('2025-03-13 08:00:00'), Timestamp('2025-03-15 08:00:00'))",Known Services Killed by Ransomware,8,,20.952,4.55,48151.0,544.0,180051968.0,618496.0,33.62890625
03/13/2025:08:00:00,03/15/2025:08:00:00,"(Timestamp('2025-03-13 08:00:00'), Timestamp('2025-03-15 08:00:00'))",Non Chrome Process Accessing Chrome Default Dir,0,,17.51,4.54,62581.0,503.0,169459712.0,434176.0,30.3203125
03/13/2025:08:00:00,03/15/2025:08:00:00,"(Timestamp('2025-03-13 08:00:00'), Timestamp('2025-03-15 08:00:00'))",Windows AD Replication Request Initiated from Unsanctioned Location,0,,33.513,10.76,157395.0,546.0,433614848.0,794624.0,42.546875
03/13/2025:08:00:00,03/15/2025:08:00:00,"(Timestamp('2025-03-13 08:00:00'), Timestamp('2025-03-15 08:00:00'))",Windows Event For Service Disabled,1,,19.863,6.52,75118.0,617.0,266092544.0,516096.0,51.359375
03/01/2025:00:00:00,03/03/2025:00:00:00,"(Timestamp('2025-03-01 00:00:00'), Timestamp('2025-03-03 00:00:00'))",Clop Ransomware Known Service Name,0,,21.475,2.67,28612.0,469.0,167055360.0,507904.0,15.8828125
03/01/2025:00:00:00,03/03/2025:00:00:00,"(Timestamp('2025-03-01 00:00:00'), Timestamp('2025-03-03 00:00:00'))",Detect New Local Admin account,0,,26.327,5.84,108737.0,640.0,142839808.0,651264.0,33.9453125
03/01/2025:00:00:00,03/03/2025:00:00:00,"(Timestamp('2025-03-01 00:00:00'), Timestamp('2025-03-03 00:00:00'))",ESCU Network Share Discovery Via Dir Command Rule,0,,24.226,6.17,79838.0,500.0,180862976.0,573440.0,22.23828125
03/01/2025:00:00:00,03/03/2025:00:00:00,"(Timestamp('2025-03-01 00:00:00'), Timestamp('2025-03-03 00:00:00'))",ESCU Windows Rapid Authentication On Multiple Hosts Rule,0,,38.235,10.7,64291.0,948.0,222044160.0,1048576.0,-39.1171875
03/01/2025:00:00:00,03/03/2025:00:00:00,"(Timestamp('2025-03-01 00:00:00'), Timestamp('2025-03-03 00:00:00'))",Kerberoasting spn request with RC4 encryption,0,,21.527,3.87,60296.0,526.0,139112448.0,520192.0,20.16796875
03/01/2025:00:00:00,03/03/2025:00:00:00,"(Timestamp('2025-03-01 00:00:00'), Timestamp('2025-03-03 00:00:00'))",Known Services Killed by Ransomware,3,,26.145,5.2,54223.0,570.0,181837824.0,745472.0,40.234375
03/01/2025:00:00:00,03/03/2025:00:00:00,"(Timestamp('2025-03-01 00:00:00'), Timestamp('2025-03-03 00:00:00'))",Non Chrome Process Accessing Chrome Default Dir,0,,22.241,5.51,72681.0,682.0,180355072.0,630784.0,-32.109375
03/01/2025:00:00:00,03/03/2025:00:00:00,"(Timestamp('2025-03-01 00:00:00'), Timestamp('2025-03-03 00:00:00'))",Windows AD Replication Request Initiated from Unsanctioned Location,0,,51.213,15.52,185558.0,594.0,826716160.0,1167360.0,38.69921875
03/01/2025:00:00:00,03/03/2025:00:00:00,"(Timestamp('2025-03-01 00:00:00'), Timestamp('2025-03-03 00:00:00'))",Windows Event For Service Disabled,1,,26.484,7.2,83199.0,647.0,252653568.0,716800.0,49.75390625
03/21/2025:20:00:00,03/23/2025:20:00:00,"(Timestamp('2025-03-21 20:00:00'), Timestamp('2025-03-23 20:00:00'))",Clop Ransomware Known Service Name,0,,5.879,2.33,26403.0,379.0,42729472.0,188416.0,16.94140625
03/21/2025:20:00:00,03/23/2025:20:00:00,"(Timestamp('2025-03-21 20:00:00'), Timestamp('2025-03-23 20:00:00'))",Detect New Local Admin account,0,,6.46,2.5500000000000003,44039.0,343.0,44654592.0,176128.0,19.734375
03/21/2025:20:00:00,03/23/2025:20:00:00,"(Timestamp('2025-03-21 20:00:00'), Timestamp('2025-03-23 20:00:00'))",ESCU Network Share Discovery Via Dir Command Rule,0,,7.384,3.5900000000000003,63340.0,423.0,27934720.0,217088.0,17.37109375
03/21/2025:20:00:00,03/23/2025:20:00:00,"(Timestamp('2025-03-21 20:00:00'), Timestamp('2025-03-23 20:00:00'))",ESCU Windows Rapid Authentication On Multiple Hosts Rule,0,,14.377,10.2,51118.0,696.0,91623424.0,409600.0,30.7734375
03/21/2025:20:00:00,03/23/2025:20:00:00,"(Timestamp('2025-03-21 20:00:00'), Timestamp('2025-03-23 20:00:00'))",Kerberoasting spn request with RC4 encryption,0,,5.767,2.76,51146.0,469.0,23461888.0,184320.0,24.36328125
03/21/2025:20:00:00,03/23/2025:20:00:00,"(Timestamp('2025-03-21 20:00:00'), Timestamp('2025-03-23 20:00:00'))",Known Services Killed by Ransomware,3,,8.861,3.98,44689.0,639.0,48476160.0,442368.0,14.44921875
03/21/2025:20:00:00,03/23/2025:20:00:00,"(Timestamp('2025-03-21 20:00:00'), Timestamp('2025-03-23 20:00:00'))",Non Chrome Process Accessing Chrome Default Dir,0,,7.163,3.4800000000000004,57754.0,574.0,26730496.0,315392.0,13.015625
03/21/2025:20:00:00,03/23/2025:20:00:00,"(Timestamp('2025-03-21 20:00:00'), Timestamp('2025-03-23 20:00:00'))",Windows AD Replication Request Initiated from Unsanctioned Location,0,,12.577,7.710000000000001,136593.0,447.0,59748352.0,331776.0,27.8203125
03/21/2025:20:00:00,03/23/2025:20:00:00,"(Timestamp('2025-03-21 20:00:00'), Timestamp('2025-03-23 20:00:00'))",Windows Event For Service Disabled,1,,9.654,5.79,69956.0,520.0,54784000.0,270336.0,27.51953125
01/04/2025:12:00:00,01/06/2025:12:00:00,"(Timestamp('2025-01-04 12:00:00'), Timestamp('2025-01-06 12:00:00'))",Clop Ransomware Known Service Name,0,,56.625,5.180000000000001,47242.0,715.0,1334190080.0,1318912.0,6.6484375
01/04/2025:12:00:00,01/06/2025:12:00:00,"(Timestamp('2025-01-04 12:00:00'), Timestamp('2025-01-06 12:00:00'))",Detect New Local Admin account,0,,71.238,9.67,153043.0,458.0,1232101376.0,1474560.0,20.05078125
01/04/2025:12:00:00,01/06/2025:12:00:00,"(Timestamp('2025-01-04 12:00:00'), Timestamp('2025-01-06 12:00:00'))",ESCU Network Share Discovery Via Dir Command Rule,0,,65.38,14.79,139169.0,580.0,799031296.0,1409024.0,17.03125
01/04/2025:12:00:00,01/06/2025:12:00:00,"(Timestamp('2025-01-04 12:00:00'), Timestamp('2025-01-06 12:00:00'))",ESCU Windows Rapid Authentication On Multiple Hosts Rule,0,,74.243,17.32,105936.0,982.0,1105199104.0,1773568.0,30.70703125
01/04/2025:12:00:00,01/06/2025:12:00:00,"(Timestamp('2025-01-04 12:00:00'), Timestamp('2025-01-06 12:00:00'))",Kerberoasting spn request with RC4 encryption,0,,58.714,9.09,96176.0,651.0,1191792640.0,1347584.0,22.0078125
01/04/2025:12:00:00,01/06/2025:12:00:00,"(Timestamp('2025-01-04 12:00:00'), Timestamp('2025-01-06 12:00:00'))",Known Services Killed by Ransomware,5,,58.083,12.83,97582.0,654.0,748056576.0,1556480.0,26.46875
01/04/2025:12:00:00,01/06/2025:12:00:00,"(Timestamp('2025-01-04 12:00:00'), Timestamp('2025-01-06 12:00:00'))",Non Chrome Process Accessing Chrome Default Dir,0,,65.227,13.489999999999998,128165.0,630.0,780460032.0,1421312.0,23.6953125
01/04/2025:12:00:00,01/06/2025:12:00:00,"(Timestamp('2025-01-04 12:00:00'), Timestamp('2025-01-06 12:00:00'))",Windows AD Replication Request Initiated from Unsanctioned Location,0,,112.618,34.970000000000006,332214.0,755.0,2240835584.0,2408448.0,29.37109375
01/04/2025:12:00:00,01/06/2025:12:00:00,"(Timestamp('2025-01-04 12:00:00'), Timestamp('2025-01-06 12:00:00'))",Windows Event For Service Disabled,1,,64.973,16.97,149620.0,747.0,894996480.0,1495040.0,37.9375
12/17/2024:16:00:00,12/19/2024:16:00:00,"(Timestamp('2024-12-17 16:00:00'), Timestamp('2024-12-19 16:00:00'))",Clop Ransomware Known Service Name,0,,17.027,2.76,20640.0,370.0,140206080.0,405504.0,17.21875
12/17/2024:16:00:00,12/19/2024:16:00:00,"(Timestamp('2024-12-17 16:00:00'), Timestamp('2024-12-19 16:00:00'))",Detect New Local Admin account,0,,22.149,3.73,42579.0,394.0,167981056.0,507904.0,23.80859375
12/17/2024:16:00:00,12/19/2024:16:00:00,"(Timestamp('2024-12-17 16:00:00'), Timestamp('2024-12-19 16:00:00'))",ESCU Network Share Discovery Via Dir Command Rule,0,,40.657,8.07,76811.0,512.0,472633344.0,983040.0,20.94921875
12/17/2024:16:00:00,12/19/2024:16:00:00,"(Timestamp('2024-12-17 16:00:00'), Timestamp('2024-12-19 16:00:00'))",ESCU Windows Rapid Authentication On Multiple Hosts Rule,0,,30.65,6.859999999999999,50840.0,688.0,336039936.0,720896.0,27.0625
12/17/2024:16:00:00,12/19/2024:16:00:00,"(Timestamp('2024-12-17 16:00:00'), Timestamp('2024-12-19 16:00:00'))",Kerberoasting spn request with RC4 encryption,0,,23.342,4.53,54499.0,475.0,158855168.0,548864.0,22.47265625
12/17/2024:16:00:00,12/19/2024:16:00:00,"(Timestamp('2024-12-17 16:00:00'), Timestamp('2024-12-19 16:00:00'))",Known Services Killed by Ransomware,0,,25.447,6.029999999999999,42700.0,478.0,289800192.0,692224.0,25.6171875
12/17/2024:16:00:00,12/19/2024:16:00:00,"(Timestamp('2024-12-17 16:00:00'), Timestamp('2024-12-19 16:00:00'))",Non Chrome Process Accessing Chrome Default Dir,0,,36.23,6.86,69732.0,509.0,359624704.0,819200.0,29.6796875
12/17/2024:16:00:00,12/19/2024:16:00:00,"(Timestamp('2024-12-17 16:00:00'), Timestamp('2024-12-19 16:00:00'))",Windows AD Replication Request Initiated from Unsanctioned Location,0,,72.473,20.09,183976.0,601.0,1598087168.0,1593344.0,45.47265625
12/17/2024:16:00:00,12/19/2024:16:00:00,"(Timestamp('2024-12-17 16:00:00'), Timestamp('2024-12-19 16:00:00'))",Windows Event For Service Disabled,2,,27.945,7.56,60911.0,562.0,371560448.0,679936.0,43.8828125
01/26/2025:04:00:00,01/28/2025:04:00:00,"(Timestamp('2025-01-26 04:00:00'), Timestamp('2025-01-28 04:00:00'))",Clop Ransomware Known Service Name,0,,28.739,3.2,33246.0,675.0,241156096.0,753664.0,6.53125
01/26/2025:04:00:00,01/28/2025:04:00:00,"(Timestamp('2025-01-26 04:00:00'), Timestamp('2025-01-28 04:00:00'))",Detect New Local Admin account,0,,34.483000000000004,5.98,112286.0,409.0,250314752.0,733184.0,19.93359375
01/26/2025:04:00:00,01/28/2025:04:00:00,"(Timestamp('2025-01-26 04:00:00'), Timestamp('2025-01-28 04:00:00'))",ESCU Network Share Discovery Via Dir Command Rule,0,,38.059,8.57,98027.0,542.0,508841984.0,847872.0,18.125
01/26/2025:04:00:00,01/28/2025:04:00:00,"(Timestamp('2025-01-26 04:00:00'), Timestamp('2025-01-28 04:00:00'))",ESCU Windows Rapid Authentication On Multiple Hosts Rule,0,,38.13,12.82,75635.0,798.0,376999936.0,933888.0,40.14453125
01/26/2025:04:00:00,01/28/2025:04:00:00,"(Timestamp('2025-01-26 04:00:00'), Timestamp('2025-01-28 04:00:00'))",Kerberoasting spn request with RC4 encryption,0,,31.079,4.859999999999999,69532.0,564.0,273936384.0,708608.0,23.30859375
01/26/2025:04:00:00,01/28/2025:04:00:00,"(Timestamp('2025-01-26 04:00:00'), Timestamp('2025-01-28 04:00:00'))",Known Services Killed by Ransomware,3,,34.881,6.67,65892.0,626.0,350572544.0,958464.0,27.80078125
01/26/2025:04:00:00,01/28/2025:04:00:00,"(Timestamp('2025-01-26 04:00:00'), Timestamp('2025-01-28 04:00:00'))",Non Chrome Process Accessing Chrome Default Dir,0,,32.598,6.619999999999999,87558.0,580.0,302977024.0,757760.0,26.0078125
01/26/2025:04:00:00,01/28/2025:04:00:00,"(Timestamp('2025-01-26 04:00:00'), Timestamp('2025-01-28 04:00:00'))",Windows AD Replication Request Initiated from Unsanctioned Location,0,,77.59100000000001,24.34,251436.0,689.0,1890852864.0,1720320.0,38.09375
01/26/2025:04:00:00,01/28/2025:04:00:00,"(Timestamp('2025-01-26 04:00:00'), Timestamp('2025-01-28 04:00:00'))",Windows Event For Service Disabled,68,,36.551,8.76,97599.0,681.0,515510272.0,921600.0,42.5625
12/27/2024:20:00:00,12/29/2024:20:00:00,"(Timestamp('2024-12-27 20:00:00'), Timestamp('2024-12-29 20:00:00'))",Clop Ransomware Known Service Name,0,,14.71,2.37,19115.0,419.0,104550400.0,356352.0,18.41015625
12/27/2024:20:00:00,12/29/2024:20:00:00,"(Timestamp('2024-12-27 20:00:00'), Timestamp('2024-12-29 20:00:00'))",Detect New Local Admin account,0,,24.213,4.81,137443.0,801.0,135667712.0,724992.0,10.51171875
12/27/2024:20:00:00,12/29/2024:20:00:00,"(Timestamp('2024-12-27 20:00:00'), Timestamp('2024-12-29 20:00:00'))",ESCU Network Share Discovery Via Dir Command Rule,0,,26.722,5.35,70187.0,460.0,242835456.0,630784.0,20.29296875
12/27/2024:20:00:00,12/29/2024:20:00:00,"(Timestamp('2024-12-27 20:00:00'), Timestamp('2024-12-29 20:00:00'))",ESCU Windows Rapid Authentication On Multiple Hosts Rule,0,,27.777,8.38,46119.0,707.0,245473280.0,712704.0,29.55859375
12/27/2024:20:00:00,12/29/2024:20:00:00,"(Timestamp('2024-12-27 20:00:00'), Timestamp('2024-12-29 20:00:00'))",Kerberoasting spn request with RC4 encryption,0,,20.221,3.5500000000000003,55259.0,526.0,142303232.0,565248.0,24.66796875
12/27/2024:20:00:00,12/29/2024:20:00:00,"(Timestamp('2024-12-27 20:00:00'), Timestamp('2024-12-29 20:00:00'))",Known Services Killed by Ransomware,6,,23.878,4.56,38253.0,532.0,185692160.0,737280.0,31.61328125
12/27/2024:20:00:00,12/29/2024:20:00:00,"(Timestamp('2024-12-27 20:00:00'), Timestamp('2024-12-29 20:00:00'))",Non Chrome Process Accessing Chrome Default Dir,0,,27.413,5.23,67996.0,544.0,222478336.0,712704.0,34.61328125
12/27/2024:20:00:00,12/29/2024:20:00:00,"(Timestamp('2024-12-27 20:00:00'), Timestamp('2024-12-29 20:00:00'))",Windows AD Replication Request Initiated from Unsanctioned Location,0,,48.796,12.17,152578.0,563.0,747872256.0,1196032.0,30.625
12/27/2024:20:00:00,12/29/2024:20:00:00,"(Timestamp('2024-12-27 20:00:00'), Timestamp('2024-12-29 20:00:00'))",Windows Event For Service Disabled,4,,23.668,5.82,57943.0,749.0,256143360.0,753664.0,37.64453125
03/26/2025:00:00:00,03/28/2025:00:00:00,"(Timestamp('2025-03-26 00:00:00'), Timestamp('2025-03-28 00:00:00'))",Clop Ransomware Known Service Name,0,,27.425,2.67,27401.0,627.0,145735680.0,720896.0,4.73828125
03/26/2025:00:00:00,03/28/2025:00:00:00,"(Timestamp('2025-03-26 00:00:00'), Timestamp('2025-03-28 00:00:00'))",Detect New Local Admin account,0,,28.027,3.5,49185.0,398.0,139218944.0,606208.0,24.12109375
03/26/2025:00:00:00,03/28/2025:00:00:00,"(Timestamp('2025-03-26 00:00:00'), Timestamp('2025-03-28 00:00:00'))",ESCU Network Share Discovery Via Dir Command Rule,0,,29.867,5.24,66988.0,474.0,243527680.0,667648.0,22.49609375
03/26/2025:00:00:00,03/28/2025:00:00:00,"(Timestamp('2025-03-26 00:00:00'), Timestamp('2025-03-28 00:00:00'))",ESCU Windows Rapid Authentication On Multiple Hosts Rule,2,,37.827,14.81,54999.0,968.0,237654016.0,1024000.0,18.03125
03/26/2025:00:00:00,03/28/2025:00:00:00,"(Timestamp('2025-03-26 00:00:00'), Timestamp('2025-03-28 00:00:00'))",Kerberoasting spn request with RC4 encryption,0,,27.611,4.2700000000000005,57624.0,523.0,177750016.0,638976.0,25.43359375
03/26/2025:00:00:00,03/28/2025:00:00:00,"(Timestamp('2025-03-26 00:00:00'), Timestamp('2025-03-28 00:00:00'))",Known Services Killed by Ransomware,3,,30.815,4.199999999999999,43815.0,561.0,230211584.0,860160.0,29.0390625
03/26/2025:00:00:00,03/28/2025:00:00:00,"(Timestamp('2025-03-26 00:00:00'), Timestamp('2025-03-28 00:00:00'))",Non Chrome Process Accessing Chrome Default Dir,0,,30.078,5.239999999999999,63905.0,540.0,226459648.0,716800.0,37.1015625
03/26/2025:00:00:00,03/28/2025:00:00:00,"(Timestamp('2025-03-26 00:00:00'), Timestamp('2025-03-28 00:00:00'))",Windows AD Replication Request Initiated from Unsanctioned Location,0,,56.999,11.9,155025.0,593.0,736935936.0,1273856.0,39.9921875
03/26/2025:00:00:00,03/28/2025:00:00:00,"(Timestamp('2025-03-26 00:00:00'), Timestamp('2025-03-28 00:00:00'))",Windows Event For Service Disabled,4,,30.954,5.930000000000001,67384.0,602.0,350654464.0,757760.0,48.60546875
12/08/2024:20:00:00,12/10/2024:20:00:00,"(Timestamp('2024-12-08 20:00:00'), Timestamp('2024-12-10 20:00:00'))",Clop Ransomware Known Service Name,0,,18.797,2.16,15496.0,358.0,140345344.0,425984.0,16.78515625
12/08/2024:20:00:00,12/10/2024:20:00:00,"(Timestamp('2024-12-08 20:00:00'), Timestamp('2024-12-10 20:00:00'))",Detect New Local Admin account,0,,24.99,2.74,35680.0,234.0,163835904.0,536576.0,19.55859375
12/08/2024:20:00:00,12/10/2024:20:00:00,"(Timestamp('2024-12-08 20:00:00'), Timestamp('2024-12-10 20:00:00'))",ESCU Network Share Discovery Via Dir Command Rule,0,,36.211,8.15,72338.0,483.0,534302720.0,880640.0,8.5703125
12/08/2024:20:00:00,12/10/2024:20:00:00,"(Timestamp('2024-12-08 20:00:00'), Timestamp('2024-12-10 20:00:00'))",ESCU Windows Rapid Authentication On Multiple Hosts Rule,0,,30.332,7.25,48955.0,678.0,381059072.0,770048.0,22.67578125
12/08/2024:20:00:00,12/10/2024:20:00:00,"(Timestamp('2024-12-08 20:00:00'), Timestamp('2024-12-10 20:00:00'))",Kerberoasting spn request with RC4 encryption,0,,26.164,4.48,48437.0,578.0,207544320.0,688128.0,9.6796875
12/08/2024:20:00:00,12/10/2024:20:00:00,"(Timestamp('2024-12-08 20:00:00'), Timestamp('2024-12-10 20:00:00'))",Known Services Killed by Ransomware,0,,22.774,5.29,37414.0,457.0,282148864.0,618496.0,26.1328125
12/08/2024:20:00:00,12/10/2024:20:00:00,"(Timestamp('2024-12-08 20:00:00'), Timestamp('2024-12-10 20:00:00'))",Non Chrome Process Accessing Chrome Default Dir,0,,35.145,6.38,62846.0,496.0,445870080.0,798720.0,20.9296875
12/08/2024:20:00:00,12/10/2024:20:00:00,"(Timestamp('2024-12-08 20:00:00'), Timestamp('2024-12-10 20:00:00'))",Windows AD Replication Request Initiated from Unsanctioned Location,0,,67.378,24.31,203598.0,487.0,1752436736.0,1449984.0,20.73046875
12/08/2024:20:00:00,12/10/2024:20:00:00,"(Timestamp('2024-12-08 20:00:00'), Timestamp('2024-12-10 20:00:00'))",Windows Event For Service Disabled,0,,24.714,6.670000000000001,52704.0,509.0,350281728.0,634880.0,28.32421875
12/19/2024:12:00:00,12/21/2024:12:00:00,"(Timestamp('2024-12-19 12:00:00'), Timestamp('2024-12-21 12:00:00'))",Clop Ransomware Known Service Name,0,,9.308,2.25,19684.0,317.0,59129856.0,237568.0,15.71875
12/19/2024:12:00:00,12/21/2024:12:00:00,"(Timestamp('2024-12-19 12:00:00'), Timestamp('2024-12-21 12:00:00'))",Detect New Local Admin account,0,,9.288,2.77,40254.0,262.0,64733184.0,221184.0,20.55078125
12/19/2024:12:00:00,12/21/2024:12:00:00,"(Timestamp('2024-12-19 12:00:00'), Timestamp('2024-12-21 12:00:00'))",ESCU Network Share Discovery Via Dir Command Rule,0,,13.693,6.43,73177.0,404.0,115138560.0,352256.0,17.30859375
12/19/2024:12:00:00,12/21/2024:12:00:00,"(Timestamp('2024-12-19 12:00:00'), Timestamp('2024-12-21 12:00:00'))",ESCU Windows Rapid Authentication On Multiple Hosts Rule,0,,11.152,5.18,47632.0,390.0,77565952.0,290816.0,18.3828125
12/19/2024:12:00:00,12/21/2024:12:00:00,"(Timestamp('2024-12-19 12:00:00'), Timestamp('2024-12-21 12:00:00'))",Kerberoasting spn request with RC4 encryption,0,,9.587,3.85,54363.0,546.0,69382144.0,344064.0,9.67578125
12/19/2024:12:00:00,12/21/2024:12:00:00,"(Timestamp('2024-12-19 12:00:00'), Timestamp('2024-12-21 12:00:00'))",Known Services Killed by Ransomware,0,,11.074,4.85,37736.0,399.0,102600704.0,339968.0,24.16796875
12/19/2024:12:00:00,12/21/2024:12:00:00,"(Timestamp('2024-12-19 12:00:00'), Timestamp('2024-12-21 12:00:00'))",Non Chrome Process Accessing Chrome Default Dir,0,,13.478,5.51,66943.0,606.0,120791040.0,434176.0,15.1484375
12/19/2024:12:00:00,12/21/2024:12:00:00,"(Timestamp('2024-12-19 12:00:00'), Timestamp('2024-12-21 12:00:00'))",Windows AD Replication Request Initiated from Unsanctioned Location,0,,26.873,15.489999999999998,173973.0,527.0,280707072.0,757760.0,37.3125
12/19/2024:12:00:00,12/21/2024:12:00:00,"(Timestamp('2024-12-19 12:00:00'), Timestamp('2024-12-21 12:00:00'))",Windows Event For Service Disabled,0,,13.412,6.69,59629.0,487.0,207261696.0,368640.0,40.76171875
12/04/2024:04:00:00,12/06/2024:04:00:00,"(Timestamp('2024-12-04 04:00:00'), Timestamp('2024-12-06 04:00:00'))",Clop Ransomware Known Service Name,0,,4.538,1.82,14516.0,359.0,12275712.0,139264.0,19.734375
12/04/2024:04:00:00,12/06/2024:04:00:00,"(Timestamp('2024-12-04 04:00:00'), Timestamp('2024-12-06 04:00:00'))",Detect New Local Admin account,0,,6.632000000000001,2.97,61302.0,347.0,30896128.0,172032.0,22.34765625
12/04/2024:04:00:00,12/06/2024:04:00:00,"(Timestamp('2024-12-04 04:00:00'), Timestamp('2024-12-06 04:00:00'))",ESCU Network Share Discovery Via Dir Command Rule,0,,12.997,6.380000000000001,70936.0,385.0,130285568.0,303104.0,21.4296875
12/04/2024:04:00:00,12/06/2024:04:00:00,"(Timestamp('2024-12-04 04:00:00'), Timestamp('2024-12-06 04:00:00'))",ESCU Windows Rapid Authentication On Multiple Hosts Rule,0,,11.274,6.119999999999999,47801.0,639.0,94867456.0,339968.0,26.78515625
12/04/2024:04:00:00,12/06/2024:04:00:00,"(Timestamp('2024-12-04 04:00:00'), Timestamp('2024-12-06 04:00:00'))",Kerberoasting spn request with RC4 encryption,0,,7.271,3.44,44381.0,421.0,52121600.0,212992.0,20.14453125
12/04/2024:04:00:00,12/06/2024:04:00:00,"(Timestamp('2024-12-04 04:00:00'), Timestamp('2024-12-06 04:00:00'))",Known Services Killed by Ransomware,0,,8.096,4.16,36028.0,417.0,57753600.0,245760.0,24.625
12/04/2024:04:00:00,12/06/2024:04:00:00,"(Timestamp('2024-12-04 04:00:00'), Timestamp('2024-12-06 04:00:00'))",Non Chrome Process Accessing Chrome Default Dir,0,,11.839,4.98,58581.0,431.0,117878784.0,294912.0,28.94921875
12/04/2024:04:00:00,12/06/2024:04:00:00,"(Timestamp('2024-12-04 04:00:00'), Timestamp('2024-12-06 04:00:00'))",Windows AD Replication Request Initiated from Unsanctioned Location,0,,39.816,23.05,201638.0,530.0,577339392.0,937984.0,48.38671875
12/04/2024:04:00:00,12/06/2024:04:00:00,"(Timestamp('2024-12-04 04:00:00'), Timestamp('2024-12-06 04:00:00'))",Windows Event For Service Disabled,0,,11.504,6.739999999999999,56846.0,470.0,124276736.0,319488.0,45.14453125
02/12/2025:00:00:00,02/14/2025:00:00:00,"(Timestamp('2025-02-12 00:00:00'), Timestamp('2025-02-14 00:00:00'))",Clop Ransomware Known Service Name,0,,28.393,3.0700000000000003,26557.0,504.0,226865152.0,651264.0,19.86328125
02/12/2025:00:00:00,02/14/2025:00:00:00,"(Timestamp('2025-02-12 00:00:00'), Timestamp('2025-02-14 00:00:00'))",Detect New Local Admin account,0,,33.381,4.8100000000000005,85037.0,413.0,248602624.0,729088.0,24.08984375
02/12/2025:00:00:00,02/14/2025:00:00:00,"(Timestamp('2025-02-12 00:00:00'), Timestamp('2025-02-14 00:00:00'))",ESCU Network Share Discovery Via Dir Command Rule,0,,33.344,6.54,78307.0,523.0,400297984.0,753664.0,22.7109375
02/12/2025:00:00:00,02/14/2025:00:00:00,"(Timestamp('2025-02-12 00:00:00'), Timestamp('2025-02-14 00:00:00'))",ESCU Windows Rapid Authentication On Multiple Hosts Rule,0,,34.552,10.6,61966.0,855.0,374902784.0,880640.0,30.60546875
02/12/2025:00:00:00,02/14/2025:00:00:00,"(Timestamp('2025-02-12 00:00:00'), Timestamp('2025-02-14 00:00:00'))",Kerberoasting spn request with RC4 encryption,0,,28.969,4.21,57376.0,604.0,261189632.0,753664.0,15.71875
02/12/2025:00:00:00,02/14/2025:00:00:00,"(Timestamp('2025-02-12 00:00:00'), Timestamp('2025-02-14 00:00:00'))",Known Services Killed by Ransomware,9,,31.495,5.56,52361.0,597.0,350396416.0,864256.0,29.6953125
02/12/2025:00:00:00,02/14/2025:00:00:00,"(Timestamp('2025-02-12 00:00:00'), Timestamp('2025-02-14 00:00:00'))",Non Chrome Process Accessing Chrome Default Dir,0,,30.616,5.2700000000000005,70456.0,596.0,270118912.0,761856.0,38.44140625
02/12/2025:00:00:00,02/14/2025:00:00:00,"(Timestamp('2025-02-12 00:00:00'), Timestamp('2025-02-14 00:00:00'))",Windows AD Replication Request Initiated from Unsanctioned Location,0,,48.481,11.24,155917.0,768.0,820436992.0,1216512.0,31.6171875
02/12/2025:00:00:00,02/14/2025:00:00:00,"(Timestamp('2025-02-12 00:00:00'), Timestamp('2025-02-14 00:00:00'))",Windows Event For Service Disabled,2,,31.263,7.46,82802.0,609.0,478887936.0,724992.0,35.26953125
02/22/2025:04:00:00,02/24/2025:04:00:00,"(Timestamp('2025-02-22 04:00:00'), Timestamp('2025-02-24 04:00:00'))",Clop Ransomware Known Service Name,0,,7.786,2.54,28365.0,383.0,56143872.0,225280.0,17.71875
02/22/2025:04:00:00,02/24/2025:04:00:00,"(Timestamp('2025-02-22 04:00:00'), Timestamp('2025-02-24 04:00:00'))",Detect New Local Admin account,0,,8.709,3.04,52999.0,350.0,52858880.0,217088.0,25.5625
02/22/2025:04:00:00,02/24/2025:04:00:00,"(Timestamp('2025-02-22 04:00:00'), Timestamp('2025-02-24 04:00:00'))",ESCU Network Share Discovery Via Dir Command Rule,0,,10.817,5.37,81375.0,669.0,74653696.0,372736.0,-38.890625
02/22/2025:04:00:00,02/24/2025:04:00:00,"(Timestamp('2025-02-22 04:00:00'), Timestamp('2025-02-24 04:00:00'))",ESCU Windows Rapid Authentication On Multiple Hosts Rule,2,,18.891,9.19,64845.0,822.0,89022464.0,573440.0,56.1796875
02/22/2025:04:00:00,02/24/2025:04:00:00,"(Timestamp('2025-02-22 04:00:00'), Timestamp('2025-02-24 04:00:00'))",Kerberoasting spn request with RC4 encryption,0,,7.917,3.51,59295.0,506.0,40271872.0,245760.0,22.1328125
02/22/2025:04:00:00,02/24/2025:04:00:00,"(Timestamp('2025-02-22 04:00:00'), Timestamp('2025-02-24 04:00:00'))",Known Services Killed by Ransomware,3,,13.865,5.14,56802.0,562.0,102715392.0,417792.0,25.09375
02/22/2025:04:00:00,02/24/2025:04:00:00,"(Timestamp('2025-02-22 04:00:00'), Timestamp('2025-02-24 04:00:00'))",Non Chrome Process Accessing Chrome Default Dir,0,,11.642,4.430000000000001,69756.0,514.0,94875648.0,311296.0,30.93359375
02/22/2025:04:00:00,02/24/2025:04:00:00,"(Timestamp('2025-02-22 04:00:00'), Timestamp('2025-02-24 04:00:00'))",Windows AD Replication Request Initiated from Unsanctioned Location,0,,34.299,14.49,190190.0,576.0,617177088.0,819200.0,44.7578125
02/22/2025:04:00:00,02/24/2025:04:00:00,"(Timestamp('2025-02-22 04:00:00'), Timestamp('2025-02-24 04:00:00'))",Windows Event For Service Disabled,1,,13.209,6.050000000000001,83102.0,561.0,157925376.0,352256.0,35.38671875
02/17/2025:08:00:00,02/19/2025:08:00:00,"(Timestamp('2025-02-17 08:00:00'), Timestamp('2025-02-19 08:00:00'))",Clop Ransomware Known Service Name,0,,6.506,2.22,29332.0,448.0,9539584.0,237568.0,18.0625
02/17/2025:08:00:00,02/19/2025:08:00:00,"(Timestamp('2025-02-17 08:00:00'), Timestamp('2025-02-19 08:00:00'))",Detect New Local Admin account,0,,10.987,3.58,83719.0,553.0,35717120.0,311296.0,21.7890625
02/17/2025:08:00:00,02/19/2025:08:00:00,"(Timestamp('2025-02-17 08:00:00'), Timestamp('2025-02-19 08:00:00'))",ESCU Network Share Discovery Via Dir Command Rule,0,,9.895,4.92,87953.0,464.0,24887296.0,278528.0,16.60546875
02/17/2025:08:00:00,02/19/2025:08:00:00,"(Timestamp('2025-02-17 08:00:00'), Timestamp('2025-02-19 08:00:00'))",ESCU Windows Rapid Authentication On Multiple Hosts Rule,0,,16.969,11.21,71415.0,753.0,35647488.0,491520.0,28.796875
02/17/2025:08:00:00,02/19/2025:08:00:00,"(Timestamp('2025-02-17 08:00:00'), Timestamp('2025-02-19 08:00:00'))",Kerberoasting spn request with RC4 encryption,0,,7.83,3.37,64096.0,507.0,11202560.0,311296.0,20.1171875
02/17/2025:08:00:00,02/19/2025:08:00:00,"(Timestamp('2025-02-17 08:00:00'), Timestamp('2025-02-19 08:00:00'))",Known Services Killed by Ransomware,11,,10.612,4.32,60147.0,585.0,38723584.0,368640.0,37.57421875
02/17/2025:08:00:00,02/19/2025:08:00:00,"(Timestamp('2025-02-17 08:00:00'), Timestamp('2025-02-19 08:00:00'))",Non Chrome Process Accessing Chrome Default Dir,0,,9.168,4.19,77739.0,517.0,36552704.0,270336.0,33.59765625
02/17/2025:08:00:00,02/19/2025:08:00:00,"(Timestamp('2025-02-17 08:00:00'), Timestamp('2025-02-19 08:00:00'))",Windows AD Replication Request Initiated from Unsanctioned Location,0,,19.615,14.03,206394.0,488.0,160186368.0,475136.0,33.66015625
02/17/2025:08:00:00,02/19/2025:08:00:00,"(Timestamp('2025-02-17 08:00:00'), Timestamp('2025-02-19 08:00:00'))",Windows Event For Service Disabled,2,,10.115,5.16,89270.0,608.0,46923776.0,352256.0,32.09375
12/21/2024:08:00:00,12/23/2024:08:00:00,"(Timestamp('2024-12-21 08:00:00'), Timestamp('2024-12-23 08:00:00'))",Clop Ransomware Known Service Name,0,,17.935,2.26,18987.0,343.0,143724544.0,421888.0,18.078125
12/21/2024:08:00:00,12/23/2024:08:00:00,"(Timestamp('2024-12-21 08:00:00'), Timestamp('2024-12-23 08:00:00'))",Detect New Local Admin account,0,,21.841,3.92,64357.0,385.0,136339456.0,499712.0,21.828125
12/21/2024:08:00:00,12/23/2024:08:00:00,"(Timestamp('2024-12-21 08:00:00'), Timestamp('2024-12-23 08:00:00'))",ESCU Network Share Discovery Via Dir Command Rule,0,,29.001,6.529999999999999,68646.0,541.0,395366400.0,741376.0,7.2421875
12/21/2024:08:00:00,12/23/2024:08:00:00,"(Timestamp('2024-12-21 08:00:00'), Timestamp('2024-12-23 08:00:00'))",ESCU Windows Rapid Authentication On Multiple Hosts Rule,0,,23.382,5.49,44701.0,418.0,290488320.0,536576.0,16.4609375
12/21/2024:08:00:00,12/23/2024:08:00:00,"(Timestamp('2024-12-21 08:00:00'), Timestamp('2024-12-23 08:00:00'))",Kerberoasting spn request with RC4 encryption,0,,21.808,3.65,50402.0,440.0,171008000.0,524288.0,21.4765625
12/21/2024:08:00:00,12/23/2024:08:00:00,"(Timestamp('2024-12-21 08:00:00'), Timestamp('2024-12-23 08:00:00'))",Known Services Killed by Ransomware,0,,18.937,4.44,34281.0,495.0,229568512.0,585728.0,27.2265625
12/21/2024:08:00:00,12/23/2024:08:00:00,"(Timestamp('2024-12-21 08:00:00'), Timestamp('2024-12-23 08:00:00'))",Non Chrome Process Accessing Chrome Default Dir,0,,27.1,5.239999999999999,62508.0,486.0,287002624.0,630784.0,21.8828125
12/21/2024:08:00:00,12/23/2024:08:00:00,"(Timestamp('2024-12-21 08:00:00'), Timestamp('2024-12-23 08:00:00'))",Windows AD Replication Request Initiated from Unsanctioned Location,0,,53.191,16.029999999999998,164401.0,514.0,1173278720.0,1171456.0,25.4375
12/21/2024:08:00:00,12/23/2024:08:00:00,"(Timestamp('2024-12-21 08:00:00'), Timestamp('2024-12-23 08:00:00'))",Windows Event For Service Disabled,0,,21.53,5.8100000000000005,52400.0,472.0,322322432.0,503808.0,26.17578125
03/30/2025:08:00:00,04/01/2025:08:00:00,"(Timestamp('2025-03-30 08:00:00'), Timestamp('2025-04-01 08:00:00'))",Clop Ransomware Known Service Name,0,,8.696,2.49,33440.0,401.0,55009280.0,315392.0,5.34765625
03/30/2025:08:00:00,04/01/2025:08:00:00,"(Timestamp('2025-03-30 08:00:00'), Timestamp('2025-04-01 08:00:00'))",Detect New Local Admin account,0,,11.612,5.1,127359.0,444.0,37036032.0,323584.0,21.94140625
03/30/2025:08:00:00,04/01/2025:08:00:00,"(Timestamp('2025-03-30 08:00:00'), Timestamp('2025-04-01 08:00:00'))",ESCU Network Share Discovery Via Dir Command Rule,0,,12.08,4.77,76019.0,526.0,64339968.0,401408.0,-49.546875
03/30/2025:08:00:00,04/01/2025:08:00:00,"(Timestamp('2025-03-30 08:00:00'), Timestamp('2025-04-01 08:00:00'))",ESCU Windows Rapid Authentication On Multiple Hosts Rule,2,,19.555,12.47,62165.0,827.0,77799424.0,647168.0,-44.92578125
03/30/2025:08:00:00,04/01/2025:08:00:00,"(Timestamp('2025-03-30 08:00:00'), Timestamp('2025-04-01 08:00:00'))",Kerberoasting spn request with RC4 encryption,0,,11.15,4.02,59531.0,502.0,54059008.0,311296.0,23.91015625
03/30/2025:08:00:00,04/01/2025:08:00:00,"(Timestamp('2025-03-30 08:00:00'), Timestamp('2025-04-01 08:00:00'))",Known Services Killed by Ransomware,3,,12.849,4.43,52391.0,661.0,77287424.0,544768.0,-42.8671875
03/30/2025:08:00:00,04/01/2025:08:00:00,"(Timestamp('2025-03-30 08:00:00'), Timestamp('2025-04-01 08:00:00'))",Non Chrome Process Accessing Chrome Default Dir,0,,11.737,4.48,72024.0,451.0,53886976.0,299008.0,22.33984375
03/30/2025:08:00:00,04/01/2025:08:00:00,"(Timestamp('2025-03-30 08:00:00'), Timestamp('2025-04-01 08:00:00'))",Windows AD Replication Request Initiated from Unsanctioned Location,0,,27.947,10.04,164741.0,503.0,276545536.0,647168.0,19.5078125
03/30/2025:08:00:00,04/01/2025:08:00:00,"(Timestamp('2025-03-30 08:00:00'), Timestamp('2025-04-01 08:00:00'))",Windows Event For Service Disabled,1,,13.661,5.86,80310.0,612.0,107393024.0,421888.0,47.3203125
01/25/2025:12:00:00,01/27/2025:12:00:00,"(Timestamp('2025-01-25 12:00:00'), Timestamp('2025-01-27 12:00:00'))",Clop Ransomware Known Service Name,0,,40.032,3.31,33547.0,505.0,572461056.0,880640.0,16.90625
01/25/2025:12:00:00,01/27/2025:12:00:00,"(Timestamp('2025-01-25 12:00:00'), Timestamp('2025-01-27 12:00:00'))",Detect New Local Admin account,0,,46.27,5.82,114942.0,392.0,522149888.0,970752.0,20.125
01/25/2025:12:00:00,01/27/2025:12:00:00,"(Timestamp('2025-01-25 12:00:00'), Timestamp('2025-01-27 12:00:00'))",ESCU Network Share Discovery Via Dir Command Rule,0,,44.247,8.35,100135.0,518.0,549769216.0,966656.0,17.02734375
01/25/2025:12:00:00,01/27/2025:12:00:00,"(Timestamp('2025-01-25 12:00:00'), Timestamp('2025-01-27 12:00:00'))",ESCU Windows Rapid Authentication On Multiple Hosts Rule,0,,44.925,11.61,75812.0,810.0,601067520.0,1056768.0,40.625
01/25/2025:12:00:00,01/27/2025:12:00:00,"(Timestamp('2025-01-25 12:00:00'), Timestamp('2025-01-27 12:00:00'))",Kerberoasting spn request with RC4 encryption,0,,40.297,4.83,70979.0,560.0,457789440.0,909312.0,23.12890625
01/25/2025:12:00:00,01/27/2025:12:00:00,"(Timestamp('2025-01-25 12:00:00'), Timestamp('2025-01-27 12:00:00'))",Known Services Killed by Ransomware,3,,42.012,6.85,67382.0,809.0,518782976.0,1277952.0,14.37109375
01/25/2025:12:00:00,01/27/2025:12:00:00,"(Timestamp('2025-01-25 12:00:00'), Timestamp('2025-01-27 12:00:00'))",Non Chrome Process Accessing Chrome Default Dir,0,,41.294,6.45,88994.0,622.0,398983168.0,946176.0,27.0625
01/25/2025:12:00:00,01/27/2025:12:00:00,"(Timestamp('2025-01-25 12:00:00'), Timestamp('2025-01-27 12:00:00'))",Windows AD Replication Request Initiated from Unsanctioned Location,0,,82.471,24.37,255177.0,829.0,1885077504.0,1892352.0,12.9375
01/25/2025:12:00:00,01/27/2025:12:00:00,"(Timestamp('2025-01-25 12:00:00'), Timestamp('2025-01-27 12:00:00'))",Windows Event For Service Disabled,63,,41.675,8.71,98820.0,653.0,578842624.0,1036288.0,35.78515625
03/19/2025:04:00:00,03/21/2025:04:00:00,"(Timestamp('2025-03-19 04:00:00'), Timestamp('2025-03-21 04:00:00'))",Clop Ransomware Known Service Name,0,,13.644,2.43,28047.0,444.0,140058624.0,335872.0,17.375
03/19/2025:04:00:00,03/21/2025:04:00:00,"(Timestamp('2025-03-19 04:00:00'), Timestamp('2025-03-21 04:00:00'))",Detect New Local Admin account,0,,17.308,4.029999999999999,81877.0,374.0,166268928.0,397312.0,23.98828125
03/19/2025:04:00:00,03/21/2025:04:00:00,"(Timestamp('2025-03-19 04:00:00'), Timestamp('2025-03-21 04:00:00'))",ESCU Network Share Discovery Via Dir Command Rule,0,,19.071,4.76,70998.0,461.0,167714816.0,458752.0,18.2421875
03/19/2025:04:00:00,03/21/2025:04:00:00,"(Timestamp('2025-03-19 04:00:00'), Timestamp('2025-03-21 04:00:00'))",ESCU Windows Rapid Authentication On Multiple Hosts Rule,0,,27.846,12.94,57153.0,774.0,202113024.0,790528.0,29.0703125
03/19/2025:04:00:00,03/21/2025:04:00:00,"(Timestamp('2025-03-19 04:00:00'), Timestamp('2025-03-21 04:00:00'))",Kerberoasting spn request with RC4 encryption,0,,13.208,3.54,56528.0,495.0,86814720.0,348160.0,25.51953125
03/19/2025:04:00:00,03/21/2025:04:00:00,"(Timestamp('2025-03-19 04:00:00'), Timestamp('2025-03-21 04:00:00'))",Known Services Killed by Ransomware,3,,20.962,4.38,48657.0,551.0,180948992.0,618496.0,24.37890625
03/19/2025:04:00:00,03/21/2025:04:00:00,"(Timestamp('2025-03-19 04:00:00'), Timestamp('2025-03-21 04:00:00'))",Non Chrome Process Accessing Chrome Default Dir,0,,17.345,4.64,64301.0,698.0,159535104.0,544768.0,29.66796875
03/19/2025:04:00:00,03/21/2025:04:00:00,"(Timestamp('2025-03-19 04:00:00'), Timestamp('2025-03-21 04:00:00'))",Windows AD Replication Request Initiated from Unsanctioned Location,0,,33.085,10.17,155554.0,548.0,421715968.0,794624.0,37.453125
03/19/2025:04:00:00,03/21/2025:04:00:00,"(Timestamp('2025-03-19 04:00:00'), Timestamp('2025-03-21 04:00:00'))",Windows Event For Service Disabled,2,,20.699,6.08,72639.0,591.0,295477248.0,520192.0,40.63671875
12/02/2024:20:00:00,12/04/2024:20:00:00,"(Timestamp('2024-12-02 20:00:00'), Timestamp('2024-12-04 20:00:00'))",Clop Ransomware Known Service Name,0,,20.213,2.38,16327.0,398.0,136912896.0,450560.0,19.95703125
12/02/2024:20:00:00,12/04/2024:20:00:00,"(Timestamp('2024-12-02 20:00:00'), Timestamp('2024-12-04 20:00:00'))",Detect New Local Admin account,0,,23.984,3.01,51490.0,440.0,146485248.0,532480.0,26.10546875
12/02/2024:20:00:00,12/04/2024:20:00:00,"(Timestamp('2024-12-02 20:00:00'), Timestamp('2024-12-04 20:00:00'))",ESCU Network Share Discovery Via Dir Command Rule,0,,37.502,8.59,75657.0,492.0,549101568.0,806912.0,25.25
12/02/2024:20:00:00,12/04/2024:20:00:00,"(Timestamp('2024-12-02 20:00:00'), Timestamp('2024-12-04 20:00:00'))",ESCU Windows Rapid Authentication On Multiple Hosts Rule,0,,31.105,7.53,52296.0,722.0,411025408.0,761856.0,35.28125
12/02/2024:20:00:00,12/04/2024:20:00:00,"(Timestamp('2024-12-02 20:00:00'), Timestamp('2024-12-04 20:00:00'))",Kerberoasting spn request with RC4 encryption,0,,26.07,4.279999999999999,48904.0,467.0,207847424.0,581632.0,31.44921875
12/02/2024:20:00:00,12/04/2024:20:00:00,"(Timestamp('2024-12-02 20:00:00'), Timestamp('2024-12-04 20:00:00'))",Known Services Killed by Ransomware,0,,24.023,5.23,36500.0,615.0,253911040.0,749568.0,21.0703125
12/02/2024:20:00:00,12/04/2024:20:00:00,"(Timestamp('2024-12-02 20:00:00'), Timestamp('2024-12-04 20:00:00'))",Non Chrome Process Accessing Chrome Default Dir,0,,35.08,6.59,63122.0,527.0,420368384.0,798720.0,41.03515625
12/02/2024:20:00:00,12/04/2024:20:00:00,"(Timestamp('2024-12-02 20:00:00'), Timestamp('2024-12-04 20:00:00'))",Windows AD Replication Request Initiated from Unsanctioned Location,0,,83.423,26.95,211330.0,628.0,1905672192.0,1835008.0,55.00390625
12/02/2024:20:00:00,12/04/2024:20:00:00,"(Timestamp('2024-12-02 20:00:00'), Timestamp('2024-12-04 20:00:00'))",Windows Event For Service Disabled,1,,27.349,7.52,57512.0,717.0,378699776.0,778240.0,39.56640625
12/05/2024:00:00:00,12/07/2024:00:00:00,"(Timestamp('2024-12-05 00:00:00'), Timestamp('2024-12-07 00:00:00'))",Clop Ransomware Known Service Name,0,,3.822,1.73,15256.0,329.0,8986624.0,135168.0,17.9921875
12/05/2024:00:00:00,12/07/2024:00:00:00,"(Timestamp('2024-12-05 00:00:00'), Timestamp('2024-12-07 00:00:00'))",Detect New Local Admin account,0,,6.2410000000000005,3.03,72839.0,510.0,18403328.0,262144.0,8.92578125
12/05/2024:00:00:00,12/07/2024:00:00:00,"(Timestamp('2024-12-05 00:00:00'), Timestamp('2024-12-07 00:00:00'))",ESCU Network Share Discovery Via Dir Command Rule,0,,8.629,5.24,68983.0,373.0,49176576.0,221184.0,15.40234375
12/05/2024:00:00:00,12/07/2024:00:00:00,"(Timestamp('2024-12-05 00:00:00'), Timestamp('2024-12-07 00:00:00'))",ESCU Windows Rapid Authentication On Multiple Hosts Rule,0,,8.343,5.65,46505.0,623.0,29044736.0,266240.0,23.7109375
12/05/2024:00:00:00,12/07/2024:00:00:00,"(Timestamp('2024-12-05 00:00:00'), Timestamp('2024-12-07 00:00:00'))",Kerberoasting spn request with RC4 encryption,0,,5.88,3.35,45524.0,421.0,23388160.0,192512.0,21.62890625
12/05/2024:00:00:00,12/07/2024:00:00:00,"(Timestamp('2024-12-05 00:00:00'), Timestamp('2024-12-07 00:00:00'))",Known Services Killed by Ransomware,0,,7.832,4.82,36876.0,581.0,55627776.0,380928.0,-37.234375
12/05/2024:00:00:00,12/07/2024:00:00:00,"(Timestamp('2024-12-05 00:00:00'), Timestamp('2024-12-07 00:00:00'))",Non Chrome Process Accessing Chrome Default Dir,0,,9.764,5.45,58840.0,428.0,80093184.0,274432.0,34.25390625
12/05/2024:00:00:00,12/07/2024:00:00:00,"(Timestamp('2024-12-05 00:00:00'), Timestamp('2024-12-07 00:00:00'))",Windows AD Replication Request Initiated from Unsanctioned Location,0,,23.333,17.25,196472.0,425.0,168148992.0,548864.0,35.9453125
12/05/2024:00:00:00,12/07/2024:00:00:00,"(Timestamp('2024-12-05 00:00:00'), Timestamp('2024-12-07 00:00:00'))",Windows Event For Service Disabled,0,,10.138,6.659999999999999,58942.0,429.0,128540672.0,270336.0,34.71484375
02/08/2025:08:00:00,02/10/2025:08:00:00,"(Timestamp('2025-02-08 08:00:00'), Timestamp('2025-02-10 08:00:00'))",Clop Ransomware Known Service Name,0,,32.318,2.97,30862.0,521.0,285659136.0,737280.0,15.90625
02/08/2025:08:00:00,02/10/2025:08:00:00,"(Timestamp('2025-02-08 08:00:00'), Timestamp('2025-02-10 08:00:00'))",Detect New Local Admin account,0,,36.525,5.720000000000001,105795.0,831.0,310333440.0,946176.0,12.03515625
02/08/2025:08:00:00,02/10/2025:08:00:00,"(Timestamp('2025-02-08 08:00:00'), Timestamp('2025-02-10 08:00:00'))",ESCU Network Share Discovery Via Dir Command Rule,0,,37.845,7.41,92795.0,537.0,448700416.0,835584.0,21.48046875
02/08/2025:08:00:00,02/10/2025:08:00:00,"(Timestamp('2025-02-08 08:00:00'), Timestamp('2025-02-10 08:00:00'))",ESCU Windows Rapid Authentication On Multiple Hosts Rule,0,,36.631,10.08,71452.0,827.0,431906816.0,966656.0,53.78515625
02/08/2025:08:00:00,02/10/2025:08:00:00,"(Timestamp('2025-02-08 08:00:00'), Timestamp('2025-02-10 08:00:00'))",Kerberoasting spn request with RC4 encryption,0,,32.902,4.44,67624.0,578.0,335585280.0,745472.0,32.59765625
02/08/2025:08:00:00,02/10/2025:08:00:00,"(Timestamp('2025-02-08 08:00:00'), Timestamp('2025-02-10 08:00:00'))",Known Services Killed by Ransomware,3,,34.236000000000004,6.5600000000000005,63078.0,788.0,383107072.0,1073152.0,18.046875
02/08/2025:08:00:00,02/10/2025:08:00:00,"(Timestamp('2025-02-08 08:00:00'), Timestamp('2025-02-10 08:00:00'))",Non Chrome Process Accessing Chrome Default Dir,0,,33.944,6.04,79924.0,736.0,302972928.0,880640.0,23.69140625
02/08/2025:08:00:00,02/10/2025:08:00:00,"(Timestamp('2025-02-08 08:00:00'), Timestamp('2025-02-10 08:00:00'))",Windows AD Replication Request Initiated from Unsanctioned Location,0,,69.738,18.93,216738.0,818.0,1544544256.0,1671168.0,35.80078125
02/08/2025:08:00:00,02/10/2025:08:00:00,"(Timestamp('2025-02-08 08:00:00'), Timestamp('2025-02-10 08:00:00'))",Windows Event For Service Disabled,1,,33.653,9.14,97049.0,615.0,527740928.0,790528.0,54.359375
12/16/2024:20:00:00,12/18/2024:20:00:00,"(Timestamp('2024-12-16 20:00:00'), Timestamp('2024-12-18 20:00:00'))",Clop Ransomware Known Service Name,0,,18.63,2.89,20305.0,412.0,155082752.0,442368.0,18.7265625
12/16/2024:20:00:00,12/18/2024:20:00:00,"(Timestamp('2024-12-16 20:00:00'), Timestamp('2024-12-18 20:00:00'))",Detect New Local Admin account,0,,23.311,4.32,82415.0,438.0,140083200.0,602112.0,13.125
12/16/2024:20:00:00,12/18/2024:20:00:00,"(Timestamp('2024-12-16 20:00:00'), Timestamp('2024-12-18 20:00:00'))",ESCU Network Share Discovery Via Dir Command Rule,0,,31.104,7.880000000000001,78248.0,498.0,366280704.0,724992.0,20.22265625
12/16/2024:20:00:00,12/18/2024:20:00:00,"(Timestamp('2024-12-16 20:00:00'), Timestamp('2024-12-18 20:00:00'))",ESCU Windows Rapid Authentication On Multiple Hosts Rule,0,,26.743,6.48,51160.0,733.0,283406336.0,712704.0,26.90234375
12/16/2024:20:00:00,12/18/2024:20:00:00,"(Timestamp('2024-12-16 20:00:00'), Timestamp('2024-12-18 20:00:00'))",Kerberoasting spn request with RC4 encryption,0,,22.33,4.63,55887.0,475.0,148193280.0,536576.0,26.609375
12/16/2024:20:00:00,12/18/2024:20:00:00,"(Timestamp('2024-12-16 20:00:00'), Timestamp('2024-12-18 20:00:00'))",Known Services Killed by Ransomware,0,,21.395,5.48,40958.0,627.0,220000256.0,720896.0,-36.69921875
12/16/2024:20:00:00,12/18/2024:20:00:00,"(Timestamp('2024-12-16 20:00:00'), Timestamp('2024-12-18 20:00:00'))",Non Chrome Process Accessing Chrome Default Dir,0,,28.932,6.52,69640.0,524.0,268640256.0,733184.0,35.46875
12/16/2024:20:00:00,12/18/2024:20:00:00,"(Timestamp('2024-12-16 20:00:00'), Timestamp('2024-12-18 20:00:00'))",Windows AD Replication Request Initiated from Unsanctioned Location,0,,60.838,19.94,188507.0,533.0,1213870080.0,1343488.0,22.5
12/16/2024:20:00:00,12/18/2024:20:00:00,"(Timestamp('2024-12-16 20:00:00'), Timestamp('2024-12-18 20:00:00'))",Windows Event For Service Disabled,2,,22.381,7.649999999999999,61314.0,508.0,228073472.0,536576.0,32.640625
12/28/2024:20:00:00,12/30/2024:20:00:00,"(Timestamp('2024-12-28 20:00:00'), Timestamp('2024-12-30 20:00:00'))",Clop Ransomware Known Service Name,0,,8.455,2.5700000000000003,21301.0,564.0,47640576.0,315392.0,6.8984375
12/28/2024:20:00:00,12/30/2024:20:00:00,"(Timestamp('2024-12-28 20:00:00'), Timestamp('2024-12-30 20:00:00'))",Detect New Local Admin account,0,,12.095,3.78,89599.0,769.0,76668928.0,450560.0,7.7578125
12/28/2024:20:00:00,12/30/2024:20:00:00,"(Timestamp('2024-12-28 20:00:00'), Timestamp('2024-12-30 20:00:00'))",ESCU Network Share Discovery Via Dir Command Rule,0,,14.134,6.18,75007.0,436.0,121131008.0,356352.0,23.76953125
12/28/2024:20:00:00,12/30/2024:20:00:00,"(Timestamp('2024-12-28 20:00:00'), Timestamp('2024-12-30 20:00:00'))",ESCU Windows Rapid Authentication On Multiple Hosts Rule,0,,17.601,9.85,50621.0,698.0,116047872.0,479232.0,33.61328125
12/28/2024:20:00:00,12/30/2024:20:00:00,"(Timestamp('2024-12-28 20:00:00'), Timestamp('2024-12-30 20:00:00'))",Kerberoasting spn request with RC4 encryption,0,,8.932,4.04,58513.0,467.0,60903424.0,262144.0,21.34765625
12/28/2024:20:00:00,12/30/2024:20:00:00,"(Timestamp('2024-12-28 20:00:00'), Timestamp('2024-12-30 20:00:00'))",Known Services Killed by Ransomware,7,,14.87,4.91,41181.0,517.0,128319488.0,487424.0,29.265625
12/28/2024:20:00:00,12/30/2024:20:00:00,"(Timestamp('2024-12-28 20:00:00'), Timestamp('2024-12-30 20:00:00'))",Non Chrome Process Accessing Chrome Default Dir,0,,18.495,6.07,74712.0,489.0,180535296.0,446464.0,33.2109375
12/28/2024:20:00:00,12/30/2024:20:00:00,"(Timestamp('2024-12-28 20:00:00'), Timestamp('2024-12-30 20:00:00'))",Windows AD Replication Request Initiated from Unsanctioned Location,0,,29.967,14.19,171309.0,559.0,424841216.0,806912.0,44.32421875
12/28/2024:20:00:00,12/30/2024:20:00:00,"(Timestamp('2024-12-28 20:00:00'), Timestamp('2024-12-30 20:00:00'))",Windows Event For Service Disabled,4,,15.864,6.279999999999999,64648.0,744.0,193835008.0,561152.0,40.0703125
12/13/2024:16:00:00,12/15/2024:16:00:00,"(Timestamp('2024-12-13 16:00:00'), Timestamp('2024-12-15 16:00:00'))",Clop Ransomware Known Service Name,0,,5.593,2.3000000000000003,18991.0,449.0,44531712.0,233472.0,2.4921875
12/13/2024:16:00:00,12/15/2024:16:00:00,"(Timestamp('2024-12-13 16:00:00'), Timestamp('2024-12-15 16:00:00'))",Detect New Local Admin account,0,,7.905,3.41,69892.0,296.0,37269504.0,204800.0,21.6171875
12/13/2024:16:00:00,12/15/2024:16:00:00,"(Timestamp('2024-12-13 16:00:00'), Timestamp('2024-12-15 16:00:00'))",ESCU Network Share Discovery Via Dir Command Rule,0,,15.891,6.41,73893.0,559.0,161185792.0,475136.0,5.87890625
12/13/2024:16:00:00,12/15/2024:16:00:00,"(Timestamp('2024-12-13 16:00:00'), Timestamp('2024-12-15 16:00:00'))",ESCU Windows Rapid Authentication On Multiple Hosts Rule,0,,12.425,5.34,48510.0,389.0,162934784.0,307200.0,18.34765625
12/13/2024:16:00:00,12/15/2024:16:00:00,"(Timestamp('2024-12-13 16:00:00'), Timestamp('2024-12-15 16:00:00'))",Kerberoasting spn request with RC4 encryption,0,,7.916,3.4000000000000004,47540.0,384.0,107335680.0,225280.0,19.4296875
12/13/2024:16:00:00,12/15/2024:16:00:00,"(Timestamp('2024-12-13 16:00:00'), Timestamp('2024-12-15 16:00:00'))",Known Services Killed by Ransomware,0,,10.157,4.74,38360.0,436.0,95891456.0,319488.0,24.30078125
12/13/2024:16:00:00,12/15/2024:16:00:00,"(Timestamp('2024-12-13 16:00:00'), Timestamp('2024-12-15 16:00:00'))",Non Chrome Process Accessing Chrome Default Dir,0,,13.323,5.5,64729.0,448.0,208732160.0,339968.0,30.53125
12/13/2024:16:00:00,12/15/2024:16:00:00,"(Timestamp('2024-12-13 16:00:00'), Timestamp('2024-12-15 16:00:00'))",Windows AD Replication Request Initiated from Unsanctioned Location,0,,36.159,18.71,185315.0,470.0,522895360.0,815104.0,26.046875
12/13/2024:16:00:00,12/15/2024:16:00:00,"(Timestamp('2024-12-13 16:00:00'), Timestamp('2024-12-15 16:00:00'))",Windows Event For Service Disabled,0,,14.438,7.13,63057.0,487.0,170135552.0,385024.0,43.63671875
02/02/2025:00:00:00,02/04/2025:00:00:00,"(Timestamp('2025-02-02 00:00:00'), Timestamp('2025-02-04 00:00:00'))",Clop Ransomware Known Service Name,0,,33.211,3.16,34765.0,488.0,260993024.0,737280.0,16.84375
02/02/2025:00:00:00,02/04/2025:00:00:00,"(Timestamp('2025-02-02 00:00:00'), Timestamp('2025-02-04 00:00:00'))",Detect New Local Admin account,0,,38.458,6.22,110892.0,670.0,314556416.0,888832.0,25.765625
02/02/2025:00:00:00,02/04/2025:00:00:00,"(Timestamp('2025-02-02 00:00:00'), Timestamp('2025-02-04 00:00:00'))",ESCU Network Share Discovery Via Dir Command Rule,0,,42.247,8.62,99035.0,555.0,521502720.0,950272.0,21.4921875
02/02/2025:00:00:00,02/04/2025:00:00:00,"(Timestamp('2025-02-02 00:00:00'), Timestamp('2025-02-04 00:00:00'))",ESCU Windows Rapid Authentication On Multiple Hosts Rule,0,,47.236,13.97,78915.0,859.0,462008320.0,1179648.0,30.61328125
02/02/2025:00:00:00,02/04/2025:00:00:00,"(Timestamp('2025-02-02 00:00:00'), Timestamp('2025-02-04 00:00:00'))",Kerberoasting spn request with RC4 encryption,0,,34.181,5.02,69947.0,586.0,273850368.0,798720.0,25.38671875
02/02/2025:00:00:00,02/04/2025:00:00:00,"(Timestamp('2025-02-02 00:00:00'), Timestamp('2025-02-04 00:00:00'))",Known Services Killed by Ransomware,3,,37.884,7.62,71557.0,634.0,409063424.0,1028096.0,29.5234375
02/02/2025:00:00:00,02/04/2025:00:00:00,"(Timestamp('2025-02-02 00:00:00'), Timestamp('2025-02-04 00:00:00'))",Non Chrome Process Accessing Chrome Default Dir,0,,36.821,6.92,89196.0,787.0,341794816.0,983040.0,29.765625
02/02/2025:00:00:00,02/04/2025:00:00:00,"(Timestamp('2025-02-02 00:00:00'), Timestamp('2025-02-04 00:00:00'))",Windows AD Replication Request Initiated from Unsanctioned Location,0,,81.257,23.360000000000003,244621.0,703.0,1783173120.0,1802240.0,46.03125
02/02/2025:00:00:00,02/04/2025:00:00:00,"(Timestamp('2025-02-02 00:00:00'), Timestamp('2025-02-04 00:00:00'))",Windows Event For Service Disabled,1,,36.164,9.81,104389.0,667.0,567156736.0,872448.0,40.5
12/29/2024:00:00:00,12/31/2024:00:00:00,"(Timestamp('2024-12-29 00:00:00'), Timestamp('2024-12-31 00:00:00'))",Clop Ransomware Known Service Name,0,,19.46,2.42,21278.0,396.0,104194048.0,454656.0,16.78125
12/29/2024:00:00:00,12/31/2024:00:00:00,"(Timestamp('2024-12-29 00:00:00'), Timestamp('2024-12-31 00:00:00'))",Detect New Local Admin account,0,,23.344,3.9,88998.0,744.0,133419008.0,671744.0,5.9921875
12/29/2024:00:00:00,12/31/2024:00:00:00,"(Timestamp('2024-12-29 00:00:00'), Timestamp('2024-12-31 00:00:00'))",ESCU Network Share Discovery Via Dir Command Rule,0,,35.809,6.34,74527.0,481.0,304336896.0,798720.0,16.625
12/29/2024:00:00:00,12/31/2024:00:00:00,"(Timestamp('2024-12-29 00:00:00'), Timestamp('2024-12-31 00:00:00'))",ESCU Windows Rapid Authentication On Multiple Hosts Rule,0,,35.974000000000004,10.95,50078.0,747.0,227848192.0,917504.0,29.1171875
12/29/2024:00:00:00,12/31/2024:00:00:00,"(Timestamp('2024-12-29 00:00:00'), Timestamp('2024-12-31 00:00:00'))",Kerberoasting spn request with RC4 encryption,0,,24.477,4.47,59029.0,658.0,138952704.0,671744.0,-38.25390625
12/29/2024:00:00:00,12/31/2024:00:00:00,"(Timestamp('2024-12-29 00:00:00'), Timestamp('2024-12-31 00:00:00'))",Known Services Killed by Ransomware,7,,27.563,5.17,41732.0,566.0,244654080.0,827392.0,23.49609375
12/29/2024:00:00:00,12/31/2024:00:00:00,"(Timestamp('2024-12-29 00:00:00'), Timestamp('2024-12-31 00:00:00'))",Non Chrome Process Accessing Chrome Default Dir,0,,36.473,6.51,74997.0,690.0,292446208.0,921600.0,-41.328125
12/29/2024:00:00:00,12/31/2024:00:00:00,"(Timestamp('2024-12-29 00:00:00'), Timestamp('2024-12-31 00:00:00'))",Windows AD Replication Request Initiated from Unsanctioned Location,0,,64.923,15.18,170259.0,607.0,754020352.0,1470464.0,38.07421875
12/29/2024:00:00:00,12/31/2024:00:00:00,"(Timestamp('2024-12-29 00:00:00'), Timestamp('2024-12-31 00:00:00'))",Windows Event For Service Disabled,4,,29.753,6.44,62983.0,590.0,323641344.0,749568.0,41.859375
02/09/2025:00:00:00,02/11/2025:00:00:00,"(Timestamp('2025-02-09 00:00:00'), Timestamp('2025-02-11 00:00:00'))",Clop Ransomware Known Service Name,0,,26.908,2.93,30765.0,503.0,198078464.0,606208.0,19.984375
02/09/2025:00:00:00,02/11/2025:00:00:00,"(Timestamp('2025-02-09 00:00:00'), Timestamp('2025-02-11 00:00:00'))",Detect New Local Admin account,0,,32.85,6.35,128970.0,654.0,165294080.0,765952.0,24.3828125
02/09/2025:00:00:00,02/11/2025:00:00:00,"(Timestamp('2025-02-09 00:00:00'), Timestamp('2025-02-11 00:00:00'))",ESCU Network Share Discovery Via Dir Command Rule,0,,36.719,7.73,94597.0,582.0,271753216.0,823296.0,24.21875
02/09/2025:00:00:00,02/11/2025:00:00:00,"(Timestamp('2025-02-09 00:00:00'), Timestamp('2025-02-11 00:00:00'))",ESCU Windows Rapid Authentication On Multiple Hosts Rule,0,,36.088,12.77,73782.0,835.0,199557120.0,966656.0,53.23828125
02/09/2025:00:00:00,02/11/2025:00:00:00,"(Timestamp('2025-02-09 00:00:00'), Timestamp('2025-02-11 00:00:00'))",Kerberoasting spn request with RC4 encryption,0,,26.911,4.7,68102.0,557.0,187408384.0,618496.0,25.71875
02/09/2025:00:00:00,02/11/2025:00:00:00,"(Timestamp('2025-02-09 00:00:00'), Timestamp('2025-02-11 00:00:00'))",Known Services Killed by Ransomware,3,,33.293,6.67,64342.0,833.0,262529024.0,1077248.0,-23.734375
02/09/2025:00:00:00,02/11/2025:00:00:00,"(Timestamp('2025-02-09 00:00:00'), Timestamp('2025-02-11 00:00:00'))",Non Chrome Process Accessing Chrome Default Dir,0,,33.648,6.17,80420.0,610.0,238014464.0,794624.0,41.0546875
02/09/2025:00:00:00,02/11/2025:00:00:00,"(Timestamp('2025-02-09 00:00:00'), Timestamp('2025-02-11 00:00:00'))",Windows AD Replication Request Initiated from Unsanctioned Location,0,,62.731,19.12,219597.0,677.0,678871040.0,1429504.0,44.9453125
02/09/2025:00:00:00,02/11/2025:00:00:00,"(Timestamp('2025-02-09 00:00:00'), Timestamp('2025-02-11 00:00:00'))",Windows Event For Service Disabled,1,,40.548,9.67,98947.0,668.0,441942016.0,937984.0,46.33203125
02/23/2025:08:00:00,02/25/2025:08:00:00,"(Timestamp('2025-02-23 08:00:00'), Timestamp('2025-02-25 08:00:00'))",Clop Ransomware Known Service Name,0,,10.966,2.83,31152.0,420.0,59666432.0,360448.0,7.42578125
02/23/2025:08:00:00,02/25/2025:08:00:00,"(Timestamp('2025-02-23 08:00:00'), Timestamp('2025-02-25 08:00:00'))",Detect New Local Admin account,0,,12.441,3.09,55194.0,262.0,51765248.0,282624.0,23.34765625
02/23/2025:08:00:00,02/25/2025:08:00:00,"(Timestamp('2025-02-23 08:00:00'), Timestamp('2025-02-25 08:00:00'))",ESCU Network Share Discovery Via Dir Command Rule,0,,15.234,5.9,83308.0,388.0,76386304.0,372736.0,14.04296875
02/23/2025:08:00:00,02/25/2025:08:00:00,"(Timestamp('2025-02-23 08:00:00'), Timestamp('2025-02-25 08:00:00'))",ESCU Windows Rapid Authentication On Multiple Hosts Rule,2,,25.524,10.25,67263.0,676.0,120848384.0,663552.0,32.3359375
02/23/2025:08:00:00,02/25/2025:08:00:00,"(Timestamp('2025-02-23 08:00:00'), Timestamp('2025-02-25 08:00:00'))",Kerberoasting spn request with RC4 encryption,0,,11.843,3.56,60622.0,422.0,41832448.0,319488.0,18.046875
02/23/2025:08:00:00,02/25/2025:08:00:00,"(Timestamp('2025-02-23 08:00:00'), Timestamp('2025-02-25 08:00:00'))",Known Services Killed by Ransomware,3,,18.082,5.5200000000000005,57910.0,521.0,124317696.0,544768.0,25.265625
02/23/2025:08:00:00,02/25/2025:08:00:00,"(Timestamp('2025-02-23 08:00:00'), Timestamp('2025-02-25 08:00:00'))",Non Chrome Process Accessing Chrome Default Dir,0,,12.962,4.6000000000000005,70000.0,513.0,70537216.0,335872.0,19.78515625
02/23/2025:08:00:00,02/25/2025:08:00:00,"(Timestamp('2025-02-23 08:00:00'), Timestamp('2025-02-25 08:00:00'))",Windows AD Replication Request Initiated from Unsanctioned Location,0,,25.75,14.18,190647.0,542.0,158527488.0,618496.0,35.91015625
02/23/2025:08:00:00,02/25/2025:08:00:00,"(Timestamp('2025-02-23 08:00:00'), Timestamp('2025-02-25 08:00:00'))",Windows Event For Service Disabled,1,,17.132,7.0,87367.0,775.0,142802944.0,585728.0,30.3515625
03/21/2025:00:00:00,03/23/2025:00:00:00,"(Timestamp('2025-03-21 00:00:00'), Timestamp('2025-03-23 00:00:00'))",Clop Ransomware Known Service Name,0,,11.089,2.39,26605.0,601.0,43274240.0,389120.0,4.4140625
03/21/2025:00:00:00,03/23/2025:00:00:00,"(Timestamp('2025-03-21 00:00:00'), Timestamp('2025-03-23 00:00:00'))",Detect New Local Admin account,0,,12.311,2.81,43396.0,768.0,38060032.0,458752.0,-45.36328125
03/21/2025:00:00:00,03/23/2025:00:00:00,"(Timestamp('2025-03-21 00:00:00'), Timestamp('2025-03-23 00:00:00'))",ESCU Network Share Discovery Via Dir Command Rule,0,,14.078,3.93,60710.0,453.0,82812928.0,364544.0,20.15625
03/21/2025:00:00:00,03/23/2025:00:00:00,"(Timestamp('2025-03-21 00:00:00'), Timestamp('2025-03-23 00:00:00'))",ESCU Windows Rapid Authentication On Multiple Hosts Rule,0,,17.816,7.2,48665.0,772.0,83714048.0,495616.0,34.46875
03/21/2025:00:00:00,03/23/2025:00:00:00,"(Timestamp('2025-03-21 00:00:00'), Timestamp('2025-03-23 00:00:00'))",Kerberoasting spn request with RC4 encryption,0,,10.813,3.12,49723.0,493.0,43724800.0,311296.0,19.78125
03/21/2025:00:00:00,03/23/2025:00:00:00,"(Timestamp('2025-03-21 00:00:00'), Timestamp('2025-03-23 00:00:00'))",Known Services Killed by Ransomware,3,,14.975,3.98,45428.0,726.0,95969280.0,610304.0,20.67578125
03/21/2025:00:00:00,03/23/2025:00:00:00,"(Timestamp('2025-03-21 00:00:00'), Timestamp('2025-03-23 00:00:00'))",Non Chrome Process Accessing Chrome Default Dir,0,,14.296,3.65,55922.0,543.0,92311552.0,450560.0,29.328125
03/21/2025:00:00:00,03/23/2025:00:00:00,"(Timestamp('2025-03-21 00:00:00'), Timestamp('2025-03-23 00:00:00'))",Windows AD Replication Request Initiated from Unsanctioned Location,0,,22.733,7.54,135023.0,512.0,211636224.0,577536.0,43.76953125
03/21/2025:00:00:00,03/23/2025:00:00:00,"(Timestamp('2025-03-21 00:00:00'), Timestamp('2025-03-23 00:00:00'))",Windows Event For Service Disabled,1,,15.849,5.430000000000001,69817.0,583.0,189620224.0,450560.0,39.984375
01/17/2025:20:00:00,01/19/2025:20:00:00,"(Timestamp('2025-01-17 20:00:00'), Timestamp('2025-01-19 20:00:00'))",Clop Ransomware Known Service Name,0,,23.707,3.3600000000000003,40826.0,673.0,170819584.0,647168.0,5.828125
01/17/2025:20:00:00,01/19/2025:20:00:00,"(Timestamp('2025-01-17 20:00:00'), Timestamp('2025-01-19 20:00:00'))",Detect New Local Admin account,0,,30.774,4.869999999999999,74523.0,760.0,191172608.0,819200.0,8.87890625
01/17/2025:20:00:00,01/19/2025:20:00:00,"(Timestamp('2025-01-17 20:00:00'), Timestamp('2025-01-19 20:00:00'))",ESCU Network Share Discovery Via Dir Command Rule,0,,35.544000000000004,9.71,112215.0,601.0,363401216.0,823296.0,21.3203125
01/17/2025:20:00:00,01/19/2025:20:00:00,"(Timestamp('2025-01-17 20:00:00'), Timestamp('2025-01-19 20:00:00'))",ESCU Windows Rapid Authentication On Multiple Hosts Rule,0,,37.793,12.37,87601.0,851.0,284532736.0,933888.0,32.171875
01/17/2025:20:00:00,01/19/2025:20:00:00,"(Timestamp('2025-01-17 20:00:00'), Timestamp('2025-01-19 20:00:00'))",Kerberoasting spn request with RC4 encryption,0,,29.582,5.42,82053.0,616.0,231063552.0,745472.0,25.515625
01/17/2025:20:00:00,01/19/2025:20:00:00,"(Timestamp('2025-01-17 20:00:00'), Timestamp('2025-01-19 20:00:00'))",Known Services Killed by Ransomware,3,,32.165,7.47,74606.0,618.0,287920128.0,905216.0,23.60546875
01/17/2025:20:00:00,01/19/2025:20:00:00,"(Timestamp('2025-01-17 20:00:00'), Timestamp('2025-01-19 20:00:00'))",Non Chrome Process Accessing Chrome Default Dir,0,,33.374,8.200000000000001,102481.0,627.0,333910016.0,831488.0,28.1796875
01/17/2025:20:00:00,01/19/2025:20:00:00,"(Timestamp('2025-01-17 20:00:00'), Timestamp('2025-01-19 20:00:00'))",Windows AD Replication Request Initiated from Unsanctioned Location,0,,79.193,25.01,289167.0,829.0,1159622656.0,1839104.0,23.71484375
01/17/2025:20:00:00,01/19/2025:20:00:00,"(Timestamp('2025-01-17 20:00:00'), Timestamp('2025-01-19 20:00:00'))",Windows Event For Service Disabled,67,,35.003,10.44,113713.0,698.0,429412352.0,937984.0,45.07421875
01/30/2025:04:00:00,02/01/2025:04:00:00,"(Timestamp('2025-01-30 04:00:00'), Timestamp('2025-02-01 04:00:00'))",Clop Ransomware Known Service Name,0,,11.231,2.93,30742.0,520.0,64581632.0,311296.0,21.4453125
01/30/2025:04:00:00,02/01/2025:04:00:00,"(Timestamp('2025-01-30 04:00:00'), Timestamp('2025-02-01 04:00:00'))",Detect New Local Admin account,0,,16.001,4.63,86513.0,663.0,73277440.0,442368.0,31.3671875
01/30/2025:04:00:00,02/01/2025:04:00:00,"(Timestamp('2025-01-30 04:00:00'), Timestamp('2025-02-01 04:00:00'))",ESCU Network Share Discovery Via Dir Command Rule,0,,18.048,7.75,99238.0,542.0,89735168.0,458752.0,24.734375
01/30/2025:04:00:00,02/01/2025:04:00:00,"(Timestamp('2025-01-30 04:00:00'), Timestamp('2025-02-01 04:00:00'))",ESCU Windows Rapid Authentication On Multiple Hosts Rule,0,,21.361,10.76,75486.0,800.0,89894912.0,573440.0,25.875
01/30/2025:04:00:00,02/01/2025:04:00:00,"(Timestamp('2025-01-30 04:00:00'), Timestamp('2025-02-01 04:00:00'))",Kerberoasting spn request with RC4 encryption,0,,14.492,4.91,72165.0,578.0,82374656.0,450560.0,26.27734375
01/30/2025:04:00:00,02/01/2025:04:00:00,"(Timestamp('2025-01-30 04:00:00'), Timestamp('2025-02-01 04:00:00'))",Known Services Killed by Ransomware,3,,17.512,5.98,64655.0,633.0,88076288.0,626688.0,26.08984375
01/30/2025:04:00:00,02/01/2025:04:00:00,"(Timestamp('2025-01-30 04:00:00'), Timestamp('2025-02-01 04:00:00'))",Non Chrome Process Accessing Chrome Default Dir,0,,17.257,6.27,86064.0,575.0,108597248.0,471040.0,44.484375
01/30/2025:04:00:00,02/01/2025:04:00:00,"(Timestamp('2025-01-30 04:00:00'), Timestamp('2025-02-01 04:00:00'))",Windows AD Replication Request Initiated from Unsanctioned Location,0,,33.085,16.830000000000002,249737.0,598.0,213377024.0,823296.0,48.14453125
01/30/2025:04:00:00,02/01/2025:04:00:00,"(Timestamp('2025-01-30 04:00:00'), Timestamp('2025-02-01 04:00:00'))",Windows Event For Service Disabled,6,,18.197,7.04,94171.0,628.0,108810240.0,491520.0,48.4140625
02/22/2025:00:00:00,02/24/2025:00:00:00,"(Timestamp('2025-02-22 00:00:00'), Timestamp('2025-02-24 00:00:00'))",Clop Ransomware Known Service Name,0,,8.538,2.6500000000000004,28633.0,458.0,24694784.0,241664.0,17.57421875
02/22/2025:00:00:00,02/24/2025:00:00:00,"(Timestamp('2025-02-22 00:00:00'), Timestamp('2025-02-24 00:00:00'))",Detect New Local Admin account,0,,9.172,3.3,52753.0,756.0,11558912.0,393216.0,9.71484375
02/22/2025:00:00:00,02/24/2025:00:00:00,"(Timestamp('2025-02-22 00:00:00'), Timestamp('2025-02-24 00:00:00'))",ESCU Network Share Discovery Via Dir Command Rule,0,,10.579,5.41,79840.0,464.0,31125504.0,282624.0,18.05859375
02/22/2025:00:00:00,02/24/2025:00:00:00,"(Timestamp('2025-02-22 00:00:00'), Timestamp('2025-02-24 00:00:00'))",ESCU Windows Rapid Authentication On Multiple Hosts Rule,2,,13.673,8.61,63339.0,770.0,29249536.0,405504.0,42.609375
02/22/2025:00:00:00,02/24/2025:00:00:00,"(Timestamp('2025-02-22 00:00:00'), Timestamp('2025-02-24 00:00:00'))",Kerberoasting spn request with RC4 encryption,0,,8.845,3.69,58183.0,507.0,41844736.0,270336.0,23.328125
02/22/2025:00:00:00,02/24/2025:00:00:00,"(Timestamp('2025-02-22 00:00:00'), Timestamp('2025-02-24 00:00:00'))",Known Services Killed by Ransomware,3,,10.979,4.96,56727.0,604.0,57573376.0,471040.0,20.5234375
02/22/2025:00:00:00,02/24/2025:00:00:00,"(Timestamp('2025-02-22 00:00:00'), Timestamp('2025-02-24 00:00:00'))",Non Chrome Process Accessing Chrome Default Dir,0,,10.174,4.62,69191.0,510.0,43552768.0,294912.0,33.4609375
02/22/2025:00:00:00,02/24/2025:00:00:00,"(Timestamp('2025-02-22 00:00:00'), Timestamp('2025-02-24 00:00:00'))",Windows AD Replication Request Initiated from Unsanctioned Location,0,,18.718,12.73,188215.0,488.0,82108416.0,458752.0,34.69140625
02/22/2025:00:00:00,02/24/2025:00:00:00,"(Timestamp('2025-02-22 00:00:00'), Timestamp('2025-02-24 00:00:00'))",Windows Event For Service Disabled,1,,12.926,6.53,81889.0,591.0,100286464.0,385024.0,44.49609375
12/19/2024:08:00:00,12/21/2024:08:00:00,"(Timestamp('2024-12-19 08:00:00'), Timestamp('2024-12-21 08:00:00'))",Clop Ransomware Known Service Name,0,,23.29,2.76,20515.0,422.0,155246592.0,540672.0,16.73046875
12/19/2024:08:00:00,12/21/2024:08:00:00,"(Timestamp('2024-12-19 08:00:00'), Timestamp('2024-12-21 08:00:00'))",Detect New Local Admin account,0,,29.828,3.15,41751.0,402.0,138178560.0,643072.0,21.74609375
12/19/2024:08:00:00,12/21/2024:08:00:00,"(Timestamp('2024-12-19 08:00:00'), Timestamp('2024-12-21 08:00:00'))",ESCU Network Share Discovery Via Dir Command Rule,0,,44.109,6.94,74603.0,529.0,425672704.0,987136.0,23.6328125
12/19/2024:08:00:00,12/21/2024:08:00:00,"(Timestamp('2024-12-19 08:00:00'), Timestamp('2024-12-21 08:00:00'))",ESCU Windows Rapid Authentication On Multiple Hosts Rule,0,,33.036,5.81,49307.0,533.0,326819840.0,835584.0,19.88671875
12/19/2024:08:00:00,12/21/2024:08:00:00,"(Timestamp('2024-12-19 08:00:00'), Timestamp('2024-12-21 08:00:00'))",Kerberoasting spn request with RC4 encryption,0,,32.118,4.09,55476.0,542.0,210477056.0,811008.0,12.37890625
12/19/2024:08:00:00,12/21/2024:08:00:00,"(Timestamp('2024-12-19 08:00:00'), Timestamp('2024-12-21 08:00:00'))",Known Services Killed by Ransomware,0,,29.49,5.609999999999999,39986.0,645.0,278306816.0,917504.0,25.859375
12/19/2024:08:00:00,12/21/2024:08:00:00,"(Timestamp('2024-12-19 08:00:00'), Timestamp('2024-12-21 08:00:00'))",Non Chrome Process Accessing Chrome Default Dir,0,,38.646,6.17,68173.0,705.0,309141504.0,987136.0,29.6953125
12/19/2024:08:00:00,12/21/2024:08:00:00,"(Timestamp('2024-12-19 08:00:00'), Timestamp('2024-12-21 08:00:00'))",Windows AD Replication Request Initiated from Unsanctioned Location,0,,72.617,17.77,177397.0,609.0,1294987264.0,1626112.0,48.52734375
12/19/2024:08:00:00,12/21/2024:08:00:00,"(Timestamp('2024-12-19 08:00:00'), Timestamp('2024-12-21 08:00:00'))",Windows Event For Service Disabled,0,,32.323,7.41,61575.0,538.0,401035264.0,765952.0,44.01171875
01/04/2025:16:00:00,01/06/2025:16:00:00,"(Timestamp('2025-01-04 16:00:00'), Timestamp('2025-01-06 16:00:00'))",Clop Ransomware Known Service Name,0,,47.561,4.85,47202.0,533.0,1089323008.0,1048576.0,17.1328125
01/04/2025:16:00:00,01/06/2025:16:00:00,"(Timestamp('2025-01-04 16:00:00'), Timestamp('2025-01-06 16:00:00'))",Detect New Local Admin account,0,,57.291,9.86,153431.0,464.0,894521344.0,1200128.0,19.8984375
01/04/2025:16:00:00,01/06/2025:16:00:00,"(Timestamp('2025-01-04 16:00:00'), Timestamp('2025-01-06 16:00:00'))",ESCU Network Share Discovery Via Dir Command Rule,0,,58.957,14.79,138707.0,563.0,790478848.0,1277952.0,16.97265625
01/04/2025:16:00:00,01/06/2025:16:00:00,"(Timestamp('2025-01-04 16:00:00'), Timestamp('2025-01-06 16:00:00'))",ESCU Windows Rapid Authentication On Multiple Hosts Rule,0,,67.143,16.59,104849.0,877.0,1108480000.0,1548288.0,29.69140625
01/04/2025:16:00:00,01/06/2025:16:00:00,"(Timestamp('2025-01-04 16:00:00'), Timestamp('2025-01-06 16:00:00'))",Kerberoasting spn request with RC4 encryption,0,,50.129,9.76,96413.0,793.0,869404672.0,1224704.0,8.8984375
01/04/2025:16:00:00,01/06/2025:16:00:00,"(Timestamp('2025-01-04 16:00:00'), Timestamp('2025-01-06 16:00:00'))",Known Services Killed by Ransomware,5,,51.885,12.1,96889.0,806.0,733663232.0,1540096.0,15.6171875
01/04/2025:16:00:00,01/06/2025:16:00:00,"(Timestamp('2025-01-04 16:00:00'), Timestamp('2025-01-06 16:00:00'))",Non Chrome Process Accessing Chrome Default Dir,0,,56.421,13.8,128069.0,649.0,710320128.0,1257472.0,28.8046875
01/04/2025:16:00:00,01/06/2025:16:00:00,"(Timestamp('2025-01-04 16:00:00'), Timestamp('2025-01-06 16:00:00'))",Windows AD Replication Request Initiated from Unsanctioned Location,0,,105.392,35.28,332593.0,775.0,2258554880.0,2318336.0,41.09765625
01/04/2025:16:00:00,01/06/2025:16:00:00,"(Timestamp('2025-01-04 16:00:00'), Timestamp('2025-01-06 16:00:00'))",Windows Event For Service Disabled,1,,57.767,16.580000000000002,147156.0,731.0,847110144.0,1327104.0,45.78515625
12/06/2024:12:00:00,12/08/2024:12:00:00,"(Timestamp('2024-12-06 12:00:00'), Timestamp('2024-12-08 12:00:00'))",Clop Ransomware Known Service Name,0,,11.839,2.36,15709.0,385.0,90521600.0,307200.0,18.90234375
12/06/2024:12:00:00,12/08/2024:12:00:00,"(Timestamp('2024-12-06 12:00:00'), Timestamp('2024-12-08 12:00:00'))",Detect New Local Admin account,0,,16.289,2.9,58402.0,532.0,113909760.0,475136.0,9.6875
12/06/2024:12:00:00,12/08/2024:12:00:00,"(Timestamp('2024-12-06 12:00:00'), Timestamp('2024-12-08 12:00:00'))",ESCU Network Share Discovery Via Dir Command Rule,0,,30.056,7.26,70259.0,450.0,454348800.0,684032.0,23.90234375
12/06/2024:12:00:00,12/08/2024:12:00:00,"(Timestamp('2024-12-06 12:00:00'), Timestamp('2024-12-08 12:00:00'))",ESCU Windows Rapid Authentication On Multiple Hosts Rule,0,,24.377,6.15,47084.0,761.0,360726528.0,716800.0,15.86328125
12/06/2024:12:00:00,12/08/2024:12:00:00,"(Timestamp('2024-12-06 12:00:00'), Timestamp('2024-12-08 12:00:00'))",Kerberoasting spn request with RC4 encryption,0,,19.531,3.49,47185.0,476.0,165470208.0,466944.0,24.25390625
12/06/2024:12:00:00,12/08/2024:12:00:00,"(Timestamp('2024-12-06 12:00:00'), Timestamp('2024-12-08 12:00:00'))",Known Services Killed by Ransomware,0,,20.915,5.0,36896.0,453.0,249835520.0,569344.0,28.05078125
12/06/2024:12:00:00,12/08/2024:12:00:00,"(Timestamp('2024-12-06 12:00:00'), Timestamp('2024-12-08 12:00:00'))",Non Chrome Process Accessing Chrome Default Dir,0,,28.055,5.46,59329.0,512.0,331403264.0,659456.0,44.3046875
12/06/2024:12:00:00,12/08/2024:12:00:00,"(Timestamp('2024-12-06 12:00:00'), Timestamp('2024-12-08 12:00:00'))",Windows AD Replication Request Initiated from Unsanctioned Location,0,,60.081,21.5,193040.0,520.0,1446395904.0,1327104.0,37.80078125
12/06/2024:12:00:00,12/08/2024:12:00:00,"(Timestamp('2024-12-06 12:00:00'), Timestamp('2024-12-08 12:00:00'))",Windows Event For Service Disabled,0,,22.775,6.87,55568.0,499.0,343986176.0,552960.0,42.47265625
01/28/2025:20:00:00,01/30/2025:20:00:00,"(Timestamp('2025-01-28 20:00:00'), Timestamp('2025-01-30 20:00:00'))",Clop Ransomware Known Service Name,0,,36.1,3.27,33506.0,494.0,263737344.0,790528.0,16.90625
01/28/2025:20:00:00,01/30/2025:20:00:00,"(Timestamp('2025-01-28 20:00:00'), Timestamp('2025-01-30 20:00:00'))",Detect New Local Admin account,0,,39.024,6.2,117309.0,679.0,271884288.0,987136.0,24.67578125
01/28/2025:20:00:00,01/30/2025:20:00:00,"(Timestamp('2025-01-28 20:00:00'), Timestamp('2025-01-30 20:00:00'))",ESCU Network Share Discovery Via Dir Command Rule,0,,40.94,8.819999999999999,102232.0,551.0,484999168.0,905216.0,19.32421875
01/28/2025:20:00:00,01/30/2025:20:00:00,"(Timestamp('2025-01-28 20:00:00'), Timestamp('2025-01-30 20:00:00'))",ESCU Windows Rapid Authentication On Multiple Hosts Rule,0,,46.042,12.93,78511.0,812.0,404664320.0,1064960.0,27.30078125
01/28/2025:20:00:00,01/30/2025:20:00:00,"(Timestamp('2025-01-28 20:00:00'), Timestamp('2025-01-30 20:00:00'))",Kerberoasting spn request with RC4 encryption,0,,35.512,5.44,73294.0,541.0,314851328.0,802816.0,18.9609375
01/28/2025:20:00:00,01/30/2025:20:00:00,"(Timestamp('2025-01-28 20:00:00'), Timestamp('2025-01-30 20:00:00'))",Known Services Killed by Ransomware,3,,38.173,6.39,65121.0,633.0,366489600.0,1056768.0,22.48828125
01/28/2025:20:00:00,01/30/2025:20:00:00,"(Timestamp('2025-01-28 20:00:00'), Timestamp('2025-01-30 20:00:00'))",Non Chrome Process Accessing Chrome Default Dir,0,,36.305,6.79,90621.0,592.0,340389888.0,835584.0,27.96875
01/28/2025:20:00:00,01/30/2025:20:00:00,"(Timestamp('2025-01-28 20:00:00'), Timestamp('2025-01-30 20:00:00'))",Windows AD Replication Request Initiated from Unsanctioned Location,0,,82.316,24.34,260104.0,828.0,1514659840.0,1884160.0,20.859375
01/28/2025:20:00:00,01/30/2025:20:00:00,"(Timestamp('2025-01-28 20:00:00'), Timestamp('2025-01-30 20:00:00'))",Windows Event For Service Disabled,7,,37.832,7.869999999999999,96671.0,707.0,458919936.0,966656.0,47.3359375
02/01/2025:00:00:00,02/03/2025:00:00:00,"(Timestamp('2025-02-01 00:00:00'), Timestamp('2025-02-03 00:00:00'))",Clop Ransomware Known Service Name,0,,8.644,2.68,35412.0,342.0,42930176.0,221184.0,17.23828125
02/01/2025:00:00:00,02/03/2025:00:00:00,"(Timestamp('2025-02-01 00:00:00'), Timestamp('2025-02-03 00:00:00'))",Detect New Local Admin account,0,,13.731,6.82,144580.0,516.0,39374848.0,364544.0,24.2421875
02/01/2025:00:00:00,02/03/2025:00:00:00,"(Timestamp('2025-02-01 00:00:00'), Timestamp('2025-02-03 00:00:00'))",ESCU Network Share Discovery Via Dir Command Rule,0,,13.745,7.4,102327.0,396.0,50126848.0,356352.0,14.32421875
02/01/2025:00:00:00,02/03/2025:00:00:00,"(Timestamp('2025-02-01 00:00:00'), Timestamp('2025-02-03 00:00:00'))",ESCU Windows Rapid Authentication On Multiple Hosts Rule,0,,19.163,10.76,81069.0,725.0,81068032.0,585728.0,24.08203125
02/01/2025:00:00:00,02/03/2025:00:00:00,"(Timestamp('2025-02-01 00:00:00'), Timestamp('2025-02-03 00:00:00'))",Kerberoasting spn request with RC4 encryption,0,,8.987,4.07,73921.0,515.0,37253120.0,339968.0,12.140625
02/01/2025:00:00:00,02/03/2025:00:00:00,"(Timestamp('2025-02-01 00:00:00'), Timestamp('2025-02-03 00:00:00'))",Known Services Killed by Ransomware,3,,15.321,6.57,72006.0,515.0,121917440.0,471040.0,29.2421875
02/01/2025:00:00:00,02/03/2025:00:00:00,"(Timestamp('2025-02-01 00:00:00'), Timestamp('2025-02-03 00:00:00'))",Non Chrome Process Accessing Chrome Default Dir,0,,14.38,5.970000000000001,92533.0,517.0,82972672.0,425984.0,23.03515625
02/01/2025:00:00:00,02/03/2025:00:00:00,"(Timestamp('2025-02-01 00:00:00'), Timestamp('2025-02-03 00:00:00'))",Windows AD Replication Request Initiated from Unsanctioned Location,0,,25.055,17.09,250965.0,525.0,115998720.0,614400.0,33.24609375
02/01/2025:00:00:00,02/03/2025:00:00:00,"(Timestamp('2025-02-01 00:00:00'), Timestamp('2025-02-03 00:00:00'))",Windows Event For Service Disabled,10,,17.545,9.2,104430.0,566.0,225538048.0,442368.0,30.93359375
12/20/2024:00:00:00,12/22/2024:00:00:00,"(Timestamp('2024-12-20 00:00:00'), Timestamp('2024-12-22 00:00:00'))",Clop Ransomware Known Service Name,0,,20.849,2.3400000000000003,20001.0,440.0,129462272.0,491520.0,17.69140625
12/20/2024:00:00:00,12/22/2024:00:00:00,"(Timestamp('2024-12-20 00:00:00'), Timestamp('2024-12-22 00:00:00'))",Detect New Local Admin account,0,,23.259,2.85,38163.0,387.0,122773504.0,524288.0,22.68359375
12/20/2024:00:00:00,12/22/2024:00:00:00,"(Timestamp('2024-12-20 00:00:00'), Timestamp('2024-12-22 00:00:00'))",ESCU Network Share Discovery Via Dir Command Rule,0,,32.524,6.23,69306.0,457.0,334094336.0,733184.0,23.09375
12/20/2024:00:00:00,12/22/2024:00:00:00,"(Timestamp('2024-12-20 00:00:00'), Timestamp('2024-12-22 00:00:00'))",ESCU Windows Rapid Authentication On Multiple Hosts Rule,0,,25.603,4.97,45262.0,474.0,239751168.0,602112.0,21.53515625
12/20/2024:00:00:00,12/22/2024:00:00:00,"(Timestamp('2024-12-20 00:00:00'), Timestamp('2024-12-22 00:00:00'))",Kerberoasting spn request with RC4 encryption,0,,24.208,3.72,51864.0,479.0,163397632.0,573440.0,21.265625
12/20/2024:00:00:00,12/22/2024:00:00:00,"(Timestamp('2024-12-20 00:00:00'), Timestamp('2024-12-22 00:00:00'))",Known Services Killed by Ransomware,0,,23.087,5.09,37749.0,509.0,219041792.0,679936.0,38.94921875
12/20/2024:00:00:00,12/22/2024:00:00:00,"(Timestamp('2024-12-20 00:00:00'), Timestamp('2024-12-22 00:00:00'))",Non Chrome Process Accessing Chrome Default Dir,0,,31.07,5.51,63021.0,533.0,271216640.0,749568.0,39.08984375
12/20/2024:00:00:00,12/22/2024:00:00:00,"(Timestamp('2024-12-20 00:00:00'), Timestamp('2024-12-22 00:00:00'))",Windows AD Replication Request Initiated from Unsanctioned Location,0,,58.289,15.14,168742.0,619.0,1108377600.0,1404928.0,35.80859375
12/20/2024:00:00:00,12/22/2024:00:00:00,"(Timestamp('2024-12-20 00:00:00'), Timestamp('2024-12-22 00:00:00'))",Windows Event For Service Disabled,0,,26.844,6.65,57385.0,485.0,322351104.0,630784.0,34.828125
03/04/2025:12:00:00,03/06/2025:12:00:00,"(Timestamp('2025-03-04 12:00:00'), Timestamp('2025-03-06 12:00:00'))",Clop Ransomware Known Service Name,0,,24.042,2.39,26200.0,632.0,138366976.0,663552.0,-46.31640625
03/04/2025:12:00:00,03/06/2025:12:00:00,"(Timestamp('2025-03-04 12:00:00'), Timestamp('2025-03-06 12:00:00'))",Detect New Local Admin account,0,,25.455,3.28,48742.0,801.0,132567040.0,720896.0,9.5390625
03/04/2025:12:00:00,03/06/2025:12:00:00,"(Timestamp('2025-03-04 12:00:00'), Timestamp('2025-03-06 12:00:00'))",ESCU Network Share Discovery Via Dir Command Rule,0,,26.28,5.59,71425.0,527.0,238321664.0,688128.0,10.3828125
03/04/2025:12:00:00,03/06/2025:12:00:00,"(Timestamp('2025-03-04 12:00:00'), Timestamp('2025-03-06 12:00:00'))",ESCU Windows Rapid Authentication On Multiple Hosts Rule,0,,40.399,10.91,59649.0,815.0,282030080.0,1077248.0,29.98828125
03/04/2025:12:00:00,03/06/2025:12:00:00,"(Timestamp('2025-03-04 12:00:00'), Timestamp('2025-03-06 12:00:00'))",Kerberoasting spn request with RC4 encryption,0,,24.841,3.9,53848.0,529.0,159420416.0,581632.0,21.27734375
03/04/2025:12:00:00,03/06/2025:12:00:00,"(Timestamp('2025-03-04 12:00:00'), Timestamp('2025-03-06 12:00:00'))",Known Services Killed by Ransomware,3,,28.089,4.86,48678.0,600.0,202907648.0,798720.0,29.83203125
03/04/2025:12:00:00,03/06/2025:12:00:00,"(Timestamp('2025-03-04 12:00:00'), Timestamp('2025-03-06 12:00:00'))",Non Chrome Process Accessing Chrome Default Dir,0,,25.434,4.68,65088.0,533.0,180379648.0,606208.0,26.13671875
03/04/2025:12:00:00,03/06/2025:12:00:00,"(Timestamp('2025-03-04 12:00:00'), Timestamp('2025-03-06 12:00:00'))",Windows AD Replication Request Initiated from Unsanctioned Location,0,,52.895,13.65,166013.0,758.0,799334400.0,1335296.0,29.6640625
03/04/2025:12:00:00,03/06/2025:12:00:00,"(Timestamp('2025-03-04 12:00:00'), Timestamp('2025-03-06 12:00:00'))",Windows Event For Service Disabled,1,,25.881,6.29,72908.0,568.0,255483904.0,630784.0,46.1171875
01/08/2025:00:00:00,01/10/2025:00:00:00,"(Timestamp('2025-01-08 00:00:00'), Timestamp('2025-01-10 00:00:00'))",Clop Ransomware Known Service Name,0,,34.550000000000004,4.12,46324.0,507.0,516845568.0,778240.0,16.99609375
01/08/2025:00:00:00,01/10/2025:00:00:00,"(Timestamp('2025-01-08 00:00:00'), Timestamp('2025-01-10 00:00:00'))",Detect New Local Admin account,0,,43.465,8.01,142108.0,632.0,441888768.0,987136.0,23.875
01/08/2025:00:00:00,01/10/2025:00:00:00,"(Timestamp('2025-01-08 00:00:00'), Timestamp('2025-01-10 00:00:00'))",ESCU Network Share Discovery Via Dir Command Rule,0,,52.682,12.66,132374.0,596.0,594067456.0,1171456.0,17.4921875
01/08/2025:00:00:00,01/10/2025:00:00:00,"(Timestamp('2025-01-08 00:00:00'), Timestamp('2025-01-10 00:00:00'))",ESCU Windows Rapid Authentication On Multiple Hosts Rule,0,,54.141,14.92,102570.0,1013.0,832483328.0,1511424.0,15.578125
01/08/2025:00:00:00,01/10/2025:00:00:00,"(Timestamp('2025-01-08 00:00:00'), Timestamp('2025-01-10 00:00:00'))",Kerberoasting spn request with RC4 encryption,0,,40.127,7.75,92530.0,570.0,564359168.0,917504.0,18.41796875
01/08/2025:00:00:00,01/10/2025:00:00:00,"(Timestamp('2025-01-08 00:00:00'), Timestamp('2025-01-10 00:00:00'))",Known Services Killed by Ransomware,3,,42.015,9.32,87384.0,657.0,525148160.0,1134592.0,28.16015625
01/08/2025:00:00:00,01/10/2025:00:00:00,"(Timestamp('2025-01-08 00:00:00'), Timestamp('2025-01-10 00:00:00'))",Non Chrome Process Accessing Chrome Default Dir,0,,49.725,11.5,121043.0,625.0,594153472.0,1159168.0,20.578125
01/08/2025:00:00:00,01/10/2025:00:00:00,"(Timestamp('2025-01-08 00:00:00'), Timestamp('2025-01-10 00:00:00'))",Windows AD Replication Request Initiated from Unsanctioned Location,0,,93.839,31.83,326433.0,718.0,1855143936.0,2064384.0,26.01953125
01/08/2025:00:00:00,01/10/2025:00:00:00,"(Timestamp('2025-01-08 00:00:00'), Timestamp('2025-01-10 00:00:00'))",Windows Event For Service Disabled,1,,53.495000000000005,13.91,137361.0,686.0,802656256.0,1204224.0,35.57421875
12/04/2024:08:00:00,12/06/2024:08:00:00,"(Timestamp('2024-12-04 08:00:00'), Timestamp('2024-12-06 08:00:00'))",Clop Ransomware Known Service Name,0,,10.871,2.23,15403.0,536.0,85524480.0,380928.0,7.40625
12/04/2024:08:00:00,12/06/2024:08:00:00,"(Timestamp('2024-12-04 08:00:00'), Timestamp('2024-12-06 08:00:00'))",Detect New Local Admin account,0,,15.603,3.13,72847.0,406.0,112590848.0,413696.0,24.46875
12/04/2024:08:00:00,12/06/2024:08:00:00,"(Timestamp('2024-12-04 08:00:00'), Timestamp('2024-12-06 08:00:00'))",ESCU Network Share Discovery Via Dir Command Rule,0,,29.28,8.110000000000001,72470.0,621.0,473894912.0,765952.0,13.54296875
12/04/2024:08:00:00,12/06/2024:08:00:00,"(Timestamp('2024-12-04 08:00:00'), Timestamp('2024-12-06 08:00:00'))",ESCU Windows Rapid Authentication On Multiple Hosts Rule,0,,23.568,6.95,48701.0,705.0,359780352.0,622592.0,28.83984375
12/04/2024:08:00:00,12/06/2024:08:00:00,"(Timestamp('2024-12-04 08:00:00'), Timestamp('2024-12-06 08:00:00'))",Kerberoasting spn request with RC4 encryption,0,,18.742,3.97,47508.0,453.0,144637952.0,466944.0,26.35546875
12/04/2024:08:00:00,12/06/2024:08:00:00,"(Timestamp('2024-12-04 08:00:00'), Timestamp('2024-12-06 08:00:00'))",Known Services Killed by Ransomware,0,,17.557,5.359999999999999,38388.0,602.0,227905536.0,614400.0,20.87890625
12/04/2024:08:00:00,12/06/2024:08:00:00,"(Timestamp('2024-12-04 08:00:00'), Timestamp('2024-12-06 08:00:00'))",Non Chrome Process Accessing Chrome Default Dir,0,,26.944,6.02,61316.0,517.0,311758848.0,667648.0,49.390625
12/04/2024:08:00:00,12/06/2024:08:00:00,"(Timestamp('2024-12-04 08:00:00'), Timestamp('2024-12-06 08:00:00'))",Windows AD Replication Request Initiated from Unsanctioned Location,0,,61.498000000000005,24.76,203603.0,570.0,1564422144.0,1388544.0,52.5546875
12/04/2024:08:00:00,12/06/2024:08:00:00,"(Timestamp('2024-12-04 08:00:00'), Timestamp('2024-12-06 08:00:00'))",Windows Event For Service Disabled,0,,21.512,7.61,57967.0,505.0,367251456.0,540672.0,48.5078125
03/11/2025:00:00:00,03/13/2025:00:00:00,"(Timestamp('2025-03-11 00:00:00'), Timestamp('2025-03-13 00:00:00'))",Clop Ransomware Known Service Name,0,,35.379,2.43,28642.0,417.0,206127104.0,782336.0,17.36328125
03/11/2025:00:00:00,03/13/2025:00:00:00,"(Timestamp('2025-03-11 00:00:00'), Timestamp('2025-03-13 00:00:00'))",Detect New Local Admin account,0,,37.762,3.1,50522.0,333.0,186966016.0,798720.0,24.97265625
03/11/2025:00:00:00,03/13/2025:00:00:00,"(Timestamp('2025-03-11 00:00:00'), Timestamp('2025-03-13 00:00:00'))",ESCU Network Share Discovery Via Dir Command Rule,0,,42.711,5.34,72836.0,475.0,353837056.0,937984.0,16.98046875
03/11/2025:00:00:00,03/13/2025:00:00:00,"(Timestamp('2025-03-11 00:00:00'), Timestamp('2025-03-13 00:00:00'))",ESCU Windows Rapid Authentication On Multiple Hosts Rule,0,,52.381,12.7,59162.0,790.0,380305408.0,1224704.0,25.7890625
03/11/2025:00:00:00,03/13/2025:00:00:00,"(Timestamp('2025-03-11 00:00:00'), Timestamp('2025-03-13 00:00:00'))",Kerberoasting spn request with RC4 encryption,0,,36.817,3.68,57829.0,503.0,244678656.0,823296.0,19.25390625
03/11/2025:00:00:00,03/13/2025:00:00:00,"(Timestamp('2025-03-11 00:00:00'), Timestamp('2025-03-13 00:00:00'))",Known Services Killed by Ransomware,3,,43.118,4.77,51056.0,772.0,341753856.0,1429504.0,15.8984375
03/11/2025:00:00:00,03/13/2025:00:00:00,"(Timestamp('2025-03-11 00:00:00'), Timestamp('2025-03-13 00:00:00'))",Non Chrome Process Accessing Chrome Default Dir,0,,38.754,4.859999999999999,66022.0,568.0,292900864.0,888832.0,37.25390625
03/11/2025:00:00:00,03/13/2025:00:00:00,"(Timestamp('2025-03-11 00:00:00'), Timestamp('2025-03-13 00:00:00'))",Windows AD Replication Request Initiated from Unsanctioned Location,0,,61.858,11.97,166260.0,576.0,745193472.0,1351680.0,27.3203125
03/11/2025:00:00:00,03/13/2025:00:00:00,"(Timestamp('2025-03-11 00:00:00'), Timestamp('2025-03-13 00:00:00'))",Windows Event For Service Disabled,1,,38.766,5.680000000000001,69410.0,593.0,401575936.0,872448.0,35.0859375
03/10/2025:00:00:00,03/12/2025:00:00:00,"(Timestamp('2025-03-10 00:00:00'), Timestamp('2025-03-12 00:00:00'))",Clop Ransomware Known Service Name,0,,4.984,2.37,28140.0,349.0,17235968.0,159744.0,18.21484375
03/10/2025:00:00:00,03/12/2025:00:00:00,"(Timestamp('2025-03-10 00:00:00'), Timestamp('2025-03-12 00:00:00'))",Detect New Local Admin account,0,,6.199,2.58,51817.0,236.0,53522432.0,155648.0,23.87890625
03/10/2025:00:00:00,03/12/2025:00:00:00,"(Timestamp('2025-03-10 00:00:00'), Timestamp('2025-03-12 00:00:00'))",ESCU Network Share Discovery Via Dir Command Rule,0,,7.283,4.76,76390.0,429.0,33591296.0,212992.0,22.1484375
03/10/2025:00:00:00,03/12/2025:00:00:00,"(Timestamp('2025-03-10 00:00:00'), Timestamp('2025-03-12 00:00:00'))",ESCU Windows Rapid Authentication On Multiple Hosts Rule,0,,12.427,9.5,60552.0,738.0,47304704.0,442368.0,25.05078125
03/10/2025:00:00:00,03/12/2025:00:00:00,"(Timestamp('2025-03-10 00:00:00'), Timestamp('2025-03-12 00:00:00'))",Kerberoasting spn request with RC4 encryption,0,,5.893,3.36,59090.0,584.0,28946432.0,282624.0,9.9140625
03/10/2025:00:00:00,03/12/2025:00:00:00,"(Timestamp('2025-03-10 00:00:00'), Timestamp('2025-03-12 00:00:00'))",Known Services Killed by Ransomware,3,,8.115,4.24,51407.0,522.0,46600192.0,286720.0,29.1875
03/10/2025:00:00:00,03/12/2025:00:00:00,"(Timestamp('2025-03-10 00:00:00'), Timestamp('2025-03-12 00:00:00'))",Non Chrome Process Accessing Chrome Default Dir,0,,6.418,4.0,64854.0,472.0,22142976.0,204800.0,24.9375
03/10/2025:00:00:00,03/12/2025:00:00:00,"(Timestamp('2025-03-10 00:00:00'), Timestamp('2025-03-12 00:00:00'))",Windows AD Replication Request Initiated from Unsanctioned Location,0,,15.217,10.84,172677.0,619.0,84221952.0,487424.0,14.85546875
03/10/2025:00:00:00,03/12/2025:00:00:00,"(Timestamp('2025-03-10 00:00:00'), Timestamp('2025-03-12 00:00:00'))",Windows Event For Service Disabled,1,,8.089,4.58,73083.0,521.0,45735936.0,245760.0,27.53515625
12/31/2024:04:00:00,01/02/2025:04:00:00,"(Timestamp('2024-12-31 04:00:00'), Timestamp('2025-01-02 04:00:00'))",Clop Ransomware Known Service Name,0,,57.626,4.970000000000001,56935.0,612.0,1027801088.0,1257472.0,18.3828125
12/31/2024:04:00:00,01/02/2025:04:00:00,"(Timestamp('2024-12-31 04:00:00'), Timestamp('2025-01-02 04:00:00'))",Detect New Local Admin account,0,,79.233,19.74,467235.0,831.0,888889344.0,1847296.0,18.7265625
12/31/2024:04:00:00,01/02/2025:04:00:00,"(Timestamp('2024-12-31 04:00:00'), Timestamp('2025-01-02 04:00:00'))",ESCU Network Share Discovery Via Dir Command Rule,0,,73.518,15.93,181477.0,860.0,909295616.0,1695744.0,-38.37109375
12/31/2024:04:00:00,01/02/2025:04:00:00,"(Timestamp('2024-12-31 04:00:00'), Timestamp('2025-01-02 04:00:00'))",ESCU Windows Rapid Authentication On Multiple Hosts Rule,0,,73.843,20.18,132750.0,963.0,1216647168.0,1736704.0,33.44140625
12/31/2024:04:00:00,01/02/2025:04:00:00,"(Timestamp('2024-12-31 04:00:00'), Timestamp('2025-01-02 04:00:00'))",Kerberoasting spn request with RC4 encryption,0,,59.061,8.82,130522.0,669.0,1123442688.0,1286144.0,32.10546875
12/31/2024:04:00:00,01/02/2025:04:00:00,"(Timestamp('2024-12-31 04:00:00'), Timestamp('2025-01-02 04:00:00'))",Known Services Killed by Ransomware,3,,63.291,12.4,115197.0,719.0,826527744.0,1708032.0,38.70703125
12/31/2024:04:00:00,01/02/2025:04:00:00,"(Timestamp('2024-12-31 04:00:00'), Timestamp('2025-01-02 04:00:00'))",Non Chrome Process Accessing Chrome Default Dir,0,,69.504,14.06,159476.0,766.0,825016320.0,1601536.0,44.90625
12/31/2024:04:00:00,01/02/2025:04:00:00,"(Timestamp('2024-12-31 04:00:00'), Timestamp('2025-01-02 04:00:00'))",Windows AD Replication Request Initiated from Unsanctioned Location,0,,152.723,43.17,423803.0,904.0,2681909248.0,3280896.0,42.34375
12/31/2024:04:00:00,01/02/2025:04:00:00,"(Timestamp('2024-12-31 04:00:00'), Timestamp('2025-01-02 04:00:00'))",Windows Event For Service Disabled,1,,63.537,14.93,154653.0,755.0,862072832.0,1429504.0,42.4140625
03/19/2025:20:00:00,03/21/2025:20:00:00,"(Timestamp('2025-03-19 20:00:00'), Timestamp('2025-03-21 20:00:00'))",Clop Ransomware Known Service Name,0,,22.677,2.12,28571.0,406.0,147820544.0,573440.0,2.60546875
03/19/2025:20:00:00,03/21/2025:20:00:00,"(Timestamp('2025-03-19 20:00:00'), Timestamp('2025-03-21 20:00:00'))",Detect New Local Admin account,0,,25.903,3.43,80805.0,236.0,145383424.0,557056.0,21.30859375
03/19/2025:20:00:00,03/21/2025:20:00:00,"(Timestamp('2025-03-19 20:00:00'), Timestamp('2025-03-21 20:00:00'))",ESCU Network Share Discovery Via Dir Command Rule,0,,28.026,4.5600000000000005,70266.0,573.0,256626688.0,716800.0,7.5234375
03/19/2025:20:00:00,03/21/2025:20:00:00,"(Timestamp('2025-03-19 20:00:00'), Timestamp('2025-03-21 20:00:00'))",ESCU Windows Rapid Authentication On Multiple Hosts Rule,0,,33.814,9.64,55446.0,677.0,260182016.0,806912.0,41.84765625
03/19/2025:20:00:00,03/21/2025:20:00:00,"(Timestamp('2025-03-19 20:00:00'), Timestamp('2025-03-21 20:00:00'))",Kerberoasting spn request with RC4 encryption,0,,22.047,2.9,55550.0,460.0,163590144.0,520192.0,18.2265625
03/19/2025:20:00:00,03/21/2025:20:00:00,"(Timestamp('2025-03-19 20:00:00'), Timestamp('2025-03-21 20:00:00'))",Known Services Killed by Ransomware,3,,28.644,4.23,49151.0,536.0,283648000.0,782336.0,21.81640625
03/19/2025:20:00:00,03/21/2025:20:00:00,"(Timestamp('2025-03-19 20:00:00'), Timestamp('2025-03-21 20:00:00'))",Non Chrome Process Accessing Chrome Default Dir,0,,26.683,4.08,61767.0,535.0,220602368.0,634880.0,30.1015625
03/19/2025:20:00:00,03/21/2025:20:00:00,"(Timestamp('2025-03-19 20:00:00'), Timestamp('2025-03-21 20:00:00'))",Windows AD Replication Request Initiated from Unsanctioned Location,0,,47.576,9.24,150848.0,549.0,691343360.0,1052672.0,34.984375
03/19/2025:20:00:00,03/21/2025:20:00:00,"(Timestamp('2025-03-19 20:00:00'), Timestamp('2025-03-21 20:00:00'))",Windows Event For Service Disabled,2,,29.74,5.69,73034.0,754.0,428228608.0,815104.0,13.23046875
01/22/2025:08:00:00,01/24/2025:08:00:00,"(Timestamp('2025-01-22 08:00:00'), Timestamp('2025-01-24 08:00:00'))",Clop Ransomware Known Service Name,0,,29.246,2.58,38095.0,436.0,203509760.0,659456.0,13.12890625
01/22/2025:08:00:00,01/24/2025:08:00:00,"(Timestamp('2025-01-22 08:00:00'), Timestamp('2025-01-24 08:00:00'))",Detect New Local Admin account,0,,37.105,6.3,127620.0,557.0,202850304.0,851968.0,20.57421875
01/22/2025:08:00:00,01/24/2025:08:00:00,"(Timestamp('2025-01-22 08:00:00'), Timestamp('2025-01-24 08:00:00'))",ESCU Network Share Discovery Via Dir Command Rule,0,,39.781,8.409999999999998,107985.0,693.0,376483840.0,995328.0,7.7265625
01/22/2025:08:00:00,01/24/2025:08:00:00,"(Timestamp('2025-01-22 08:00:00'), Timestamp('2025-01-24 08:00:00'))",ESCU Windows Rapid Authentication On Multiple Hosts Rule,0,,38.6,12.5,82030.0,728.0,255524864.0,983040.0,34.31640625
01/22/2025:08:00:00,01/24/2025:08:00:00,"(Timestamp('2025-01-22 08:00:00'), Timestamp('2025-01-24 08:00:00'))",Kerberoasting spn request with RC4 encryption,0,,31.093,4.63,77943.0,732.0,199589888.0,815104.0,7.40234375
01/22/2025:08:00:00,01/24/2025:08:00:00,"(Timestamp('2025-01-22 08:00:00'), Timestamp('2025-01-24 08:00:00'))",Known Services Killed by Ransomware,3,,36.64,6.69,72691.0,580.0,284356608.0,983040.0,25.8125
01/22/2025:08:00:00,01/24/2025:08:00:00,"(Timestamp('2025-01-22 08:00:00'), Timestamp('2025-01-24 08:00:00'))",Non Chrome Process Accessing Chrome Default Dir,0,,35.829,6.710000000000001,96150.0,590.0,342073344.0,831488.0,24.04296875
01/22/2025:08:00:00,01/24/2025:08:00:00,"(Timestamp('2025-01-22 08:00:00'), Timestamp('2025-01-24 08:00:00'))",Windows AD Replication Request Initiated from Unsanctioned Location,0,,71.294,22.9,264937.0,683.0,1083326464.0,1638400.0,22.8203125
01/22/2025:08:00:00,01/24/2025:08:00:00,"(Timestamp('2025-01-22 08:00:00'), Timestamp('2025-01-24 08:00:00'))",Windows Event For Service Disabled,8,,36.789,8.48,105972.0,673.0,405520384.0,856064.0,46.99609375
01/30/2025:16:00:00,02/01/2025:16:00:00,"(Timestamp('2025-01-30 16:00:00'), Timestamp('2025-02-01 16:00:00'))",Clop Ransomware Known Service Name,0,,7.366,2.46,34619.0,458.0,34811904.0,266240.0,18.46875
01/30/2025:16:00:00,02/01/2025:16:00:00,"(Timestamp('2025-01-30 16:00:00'), Timestamp('2025-02-01 16:00:00'))",Detect New Local Admin account,0,,10.689,4.18,97775.0,310.0,58019840.0,245760.0,24.1640625
01/30/2025:16:00:00,02/01/2025:16:00:00,"(Timestamp('2025-01-30 16:00:00'), Timestamp('2025-02-01 16:00:00'))",ESCU Network Share Discovery Via Dir Command Rule,0,,12.632,6.23,100039.0,397.0,71843840.0,315392.0,13.21484375
01/30/2025:16:00:00,02/01/2025:16:00:00,"(Timestamp('2025-01-30 16:00:00'), Timestamp('2025-02-01 16:00:00'))",ESCU Windows Rapid Authentication On Multiple Hosts Rule,0,,14.49,8.33,74849.0,727.0,65880064.0,413696.0,22.58203125
01/30/2025:16:00:00,02/01/2025:16:00:00,"(Timestamp('2025-01-30 16:00:00'), Timestamp('2025-02-01 16:00:00'))",Kerberoasting spn request with RC4 encryption,0,,8.663,3.8,70774.0,466.0,50233344.0,245760.0,18.9921875
